machine_generated_transcripts,original_transcript
sudbene vlasti u političkom životu u diplomatskim predstavništvima članovima odbora povjerenstva i za slanstava i tako dalje tako da što se tiče zakona o ravnopravnosti spolova imamo dobru regulaciju zakona ali i podaci koje su uvažene zastupnici i zastupnici,sudbene vlasti u političkom životu u diplomatskim predstavništvima članovima odbora povjerenstva izaslanstava itd tako da što se tiče zakona o ravnopravnosti spolova imamo dobru regulaciju zakona ali i podaci koje su uvažene zastupnice i zastupnici
kaošto je kolega prethod napomenu vodese radi isključio o radnitvarimo o rasladnoj tehnici protu požarnim uređajima i postoje više čimbenika koju nečičuju okolišsmo se fokusirali na ove koje su,kao što je kolega prethodno napomenuo ovdje se radi isključivo o radnim tvarima u rashladnoj tehnici protupožarnim uređajima i postoji više čimbenika koji onečišćuju okoliš a ovdje smo se fokusirali na ove koji su
2irećine današnje razine spomenutih plinova u eu i to predstavlja važam koraku postizanje dugoročnih ciljeva smanjenja stakleničkih plinova u ukviru klimatske politike e uje te prinosi i ciljevima pariškog sporazuma uredba se odnosi na lor ugljikovodih,23 današnje razine spomenutih plinova u europskoj uniji i to predstavlja važan korak u postizanju dugoročnih ciljeva smanjenja stakleničkih plinova u okviru klimatske politike europske unije te doprinosi ciljevima pariškog sporazuma uredba se odnosi na fluorougljikovodike
edukacijski rehabilitatori nadležno tijelo za navedenu,edukacijski rehabilitatori nadležno tijelo za navedenu
ovršna isprava deset godina zbog 70 kna hrt pretplate aovim ijučerašnjim zakonom ovrsi to i dalje nije promijenjeno kaže mladi želim živjeti uređeno i držav jer želim ovdje stvoriti dom želim stvoriti dom ali nemam stalan posao i,ovršna isprava 10g zbog 80 kn hrt pretplate a ovim jučerašnjim zakonom o ovrsi to i dalje nije promijenjeno kažu mladi želim živjeti u uređenoj državi jer želimo ovdje stvoriti dom želim stvoriti dom ali nemam stalan posao i
muje iznosila oko 24 pol milijarde kuna i u fondu je bilo 53200 članova k kncem godine prinoskoji je ostvaren u 20116. godini je 73 a od početka rada,mu je iznosila oko 24 i pol milijarde kuna i u fondu je bilo 532 tisuće članova koncem godine prinos koji je ostvaren u 2016. godini je 731a od početka rada
duže vrijeme liberalizirana i hvala bogu da je liberaliziranajai su se pokazali da pojed pojedina industrija dobavlja jestinije i bolje cene plina što se tiče vizije,duže vrijeme liberalizirana i hvala bogu da je liberalizirana jer su se pokazali da pojedina industrija dobavlja jeftinije i bolje cijene plina što se tiče vizije
i uzeuši obzir sve navedeno razvidna je potreba donošenja ovog zakona također srećepozornostkako je potrebno da ovaj zakon stupi na snagu isto brijeme kad i zakon o izmjenama i dopunama zakona o zaštiti zraka to je bitno zato je odredbama zakona o zašti zraka potrebnu staviti iovan snagie odredbe koji se odnose na provedbu,i uzevši u obzir sve navedeno razvidna je potreba donošenja ovog zakona također skrećemo pozornost kako je potrebno da ovaj zakon stupi na snagu u isto vrijeme kada i zakon o izmjenama i dopunama zakona o zaštiti zraka to je bitno zato jer je odredbama zakona o zaštiti zraka potrebno staviti van snage odredbe koje se odnose na provedbu
a ostoj više tom zastupniku koji je bio do sada zači prema do sadašjem rješenju i to se odnosi i na nezavisne viječnike na taj način sva prava i obveze temelnje fiinancijskog poslovanja prelaze na političku stranku te se smanjuje obveza navedenih nezavisnih zastupnika i nezavisnih viješnika također,a ostaju više tom zastupniku koji je bio do sada znači prema dosadašnjem rješenju isto se odnosi i na nezavisne vijećnike na taj način sva prava i obveze temeljem financijskog poslovanja prelaze na političku stranku te se smanjuje obveza navedenih nezavisnih zastupnika i nezavisnih vijećnika također
predsaničkih tijela u jedinicama lokalnih samouprave o kojima čelnici smatraju da njihov rad nije važen da su im možda dizači ruku te njihov rad nači vrednju sa ednim punm na godišnjojj razini i nismo znači propisali iznos maksimalni nači stavili smo minimalne iznose što,predstavničkih tijela u jedinicama lokalne samouprave u kojima čelnici smatraju da njihov rad nije važan da su im možda dižući ruku te njihov rad znači vrednuju sa 1 kn na godišnjoj razini i nismo propisali iznos maksimalni znači stavili smo minimalne iznose što
komisiju mi njernim sručnim službama upisnik žalbenih predmeta odluke državne komisije i zaključici o pravnim svačanjima javnosu opljavljeni u realnom vru na stranicama državne komisije što dovodi do predvidjivosti pravne zaštite i veće dostupnosti rada institucije sve navedeno u velikoj mjeri do prinosi pravnej sigurnosti,komisijom i njenim stručnim službama upisnik žalbenih predmeta odluke državne komisije i zaključci o pravnim shvaćanjima javno su objavljeni u realnom vremenu na stranicama državne komisije što dovodi do predvidivosti pravne zaštite i veće dostupnosti rada institucije sve navedeno u velikoj mjeri doprinosi pravnoj sigurnosti i
hvala gospodine predsjedniče uvažene zastupnice i zastupnici konačnim prijedlogom zakona zakon o ravnopravnosti spolova usklađuje se sa zahtjevima europske komisije u odnosu na direktivu europskog parlamenta i vijeća od  srpnja 206.. godine o provedbi jednakih,hvala gospodine predsjedniče uvažene zastupnice i zastupnici konačnim prijedlogom zakona zakon o ravnopravnosti spolova usklađuje se sa zahtjevima europske komisije u odnosu na direktivu europskog parlamenta i vijeća od 5. srpnja 206. godine o provedbi jednakih
rad njihovih članova predstavničkog tijela govorejći općinskim gradskim vijećima ili županijskim skupštinama smatramo da sus obzirom na prihode koje ostvaruju jedinice lokalne samouprave upravo znači od poreznih obveznika i građana rh imali smo ne srazije da su pojedine i,rad njihovih članova predstavničkog tijela govoreći o općinski gradskim vijećima ili županijskim skupštinama smatramo da s obzirom na prihode koje ostvaruju jedinice lokalne samouprave upravo znači od poreznih obveznika i građana rh imali smo nesrazmjer da su pojedine
doživio slom što smo također čuli to jednostavno nije nije istina činjenica da velika većina ljudi koju u ovom trenutku odlaze u mirovinu a članovisu drgdrugog mirovinskog stupa dobrovoljno je rezultat 2ije vrlo objektivne činjenice a je to što su relativno,doživio slom što smo također čuli to jednostavno nije istina činjenica da velika većina ljudi koji u ovom trenutku odlaze u mirovinu a članovi su drugog mirovinskog stupa dobrovoljno je rezultat dvije vrlo objektivne činjenice jedna je to što su relativno
utvrđuje se da u slučaju ako nezavisni zastupnik poslane član političke stranke koja participira u hrvatskom saboru sredstva za redovito godišnje financiranje iz proračuna pripada i u političkoj stranci čije postao čla a ostaju nači,utvrđuje se da u slučaju ako nezavisni zastupnik postane član političke stranke koja participira u hsu sredstva za redovito godišnje financiranje iz proračuna pripadaju političkoj stranci čiji je postao član a ostaju znači
poštovane potpredsjedniče hog sbora uvažene zastupnice i zastupnici vlada r h ala mišljenje o izvješšću rad u ht energets regulatorne agencije za 215. izvješću ostvarenju proračunahr za 205. godinu izvješće o radu zajedno si izvješćen o financijskom posloanju je ostvarenenju proračuna,poštovani potpredsjedniče hrvatskoga sabora uvažene zastupnice i zastupnici vlada rh je dala mišljenje o izvješću o radu hrvatske energetske regulatorne agencije za 2015. o izvješću o ostvarenju proračuna herae za 2015. godinu izvješće o radu zajedno sa izvješćem o financijskom poslovanju i ostvarenju proračuna
kontinuirano da nadopunjuje potrebno je stalno usklađivanje hrvtskog energetskog zakonodavstva tako se zakonomno o izmjenama i dopunama zakona tržištu plina opčirno uređuju nova pravila na tržištu plina te su stoga iznačajne promjene provedene u izmjeni zakona,kontinuirano nadopunjuje potrebno je stalno usklađivanje hrvatskog energetskog zakonodavstva tako se zakonom o izmjenama i dopunama zakona o tržištu plina opširno uređuju nova pravila na tržištu plina te su stoga i značajne promjene provedene u izmjeni zakona
treba napomenuti da to ne znači da čla nema na računu i ono što mo j u glavnici nego da je to na tu glavnicu zarađen i tih 6 je sasvom solidan prinos mislimda je to bilo potrebno ovako da kažem kao objašnjenje ne znam da li sam odgovorio na sva pitanja,treba napomenuti da to ne znači da član nema na računu i ono što mu je u glavnici nego da je to na tu glavnicu zarađeno i tih 6 je sasvim solidan prinos i mislim da je to bilo potrebno ovako da kažem kao objašnjenje ne znam da li sam odgovorio na sva pitanja
poligon javne uprave i županija želi govoriti protiv županija koje nisu ništa drugo nego transvert novca i zapravo razvijaju još veći klijentalizam onaj od župana prema načelnicima i gradonačelnicima manjih gradova jer oni onda moraju šutit kao što građani,poligon javne uprave i u županije želim govoriti protiv županija koje nisu ništa drugo nego transfer novca i zapravo razvijaju još veći klijentelizam onaj od župana prema načelnicima i gradonačelnicima manjih gradova jer oni onda moraju šutjeti kao što građani
uvaženi saborski zastupniče vi možete imat svoje mišjenje viđenje i kao čelnik jedinice lokalne samouprave imate pravo predlagati svoj proračun ali s obzirom da je ovo zakon koje regulira i koliko vi kao budući kandidati i do sadašnjih kandidat na lokalnim izborima,uvaženi saborski zastupniče vi možete imati svoje mišljenje i viđenje i kao čelnik jedinice lokalne samouprave imate pravo predlagati svoj proračun ali s obzirom da je ovo zakon koji regulira i ukoliko vi kao budući kandidat i dosadašnji kandidat na lokalnim izborima
u 2017. godini došlo je do skrćivanja prosjčnog trajnja žalbodnog postupka za 2 dana unatoć povećanju o 2 u broju žalbi koji su pristikle u državno komisijo kao što sam već spomenula spomenu sam zači mogućnost elektroničkog izjavljivanja žalbe treba posebno istaknuti ono što je naglašeno,u 2017. godini došlo je do skraćivanja prosječnog trajanja žalbenog postupka za 2 dana unatoč povećanju od 25 u broju žalbi koje su pristigle u državnu komisiju kao što sam već spomenula a spomenula sam znači i mogućnost elektroničkog izjavljivanja žalbe treba posebno istaknuti ono što je naglašeno
vremenski dakle perioda  tookom jedne godine ili više grazdoblja tako da više nije potrebno dobiti suglasnot poslodavca nego samo zaprimljenu obavjstod strane poslodavta što je i primjereno jer je zakonskom to pravo uređeno a  da korisnik rodilnjih roviteljski ima pravo na fleksibilno korištenje i promjenu statusa ali,vremenski dakle perioda tokom jedne godine ili višeg razdoblja tako da više nije potrebno dobiti suglasnost poslodavca nego samo zaprimljenu obavijest od strane poslodavca što je i primjereno jer je zakonskom to pravo uređeno da korisnik rodiljnih roditeljskih ima pravo na fleksibilno korištenje i promjenu statusa ali
zaposle da mogu to pravo prenjeti na svoga na drugoga roditelja što dosadašnjim postajćim odredbanom zakona koji su na snazi bilo 2008 godine nije bilo moguće konkretno to znači ako se nezaposlena maneka zaposli da to svoje pravo može primnjeti dakle na na c,zaposle da mogu to pravo prenijeti na drugoga roditelja što dosadašnjim postojećim odredbama zakona koje su na snazi bile od 208. g nije bilo moguće konkretno to znači ako se nezaposlena majka zaposli da to svoje pravo može prenijeti na oca
očeva odnosno veće prinušenje prava na očeve koji će u tom fleksibilnomobliku rade i na taj način dodatno poboljšati položežena na tržišto raa i njihovu veći i bolji položaj karijerni u ukarinom dak smislu nadalje drugom stavkom,očeva odnosno veće prenošenje prava na očeve koji će u tom fleksibilnom obliku rada i na taj način dodatno poboljšati položaj žena na tržištu rada i njihov veći i bolji položaj karijerni u karijernom dakle smislu nadalje drugom stavkom
htio sam pričekat dase svi očćitoeje t l nisam iše mogao izdržat ževin oa demistiticirati u populističku temu koja je krenilo sada,evo htio sam pričekat da se svi očitujete ali nisam više mogao izdržati želim demistificirati ovu populističku temu koja je krenula sada
najveći fond kategorije b s obzirom da nije došlo do nekog značajnijeg pomicanja i vlastitog odlučivanja članoova o tome da promijene obvezni mirovinskih fonda u obvezni mirinoveznimerovinski fond kategorije b u startu je bio jedini a i danas je mirovinski fond u,najveći fond kategorije b s obzirom da nije došlo do nekog značajnijeg pomicanja i vlastitog odlučivanja članova o tome da promjene obvezni mirovinski fond a obvezni mirovinski fond kategorije b u startu je jedini a i danas je mirovinski fond u
sadrži podatke kao zapažanja po pojedinim poglavljima u kojima se vlo sažeto daje ocjna stanja po pojedinoj temi te samo mjestivično daje kratka preporuka ilekritika primijećeno je da se dijelu izvješća o radu koji bi trebao jasno pisioati rahr samo navode donesene odluke akti te,sadrži podatke kao i zapažanja po pojedinim poglavljima u kojima se vrlo sažeto daje ocjena stanja po pojedinoj temi te samo mjestimično daje kratka preporuka ili kritika primijećeno je da se dijelu izvješća o radu koji bi trebao jasno opisivati rad herae samo navode donesene odluke i akti te
konačnici sigurno predstavljeda snačan i fiskalni učinak i značajno poboljšanje materijalnog polžaja roditelja bilo je pitanje oko stranaca prebivalište da li strancimgrodilje koristiti pravo dakle stranci mogu koristiti ukuliku i imaju prebivalište ili stalni boravak prijavnjen u,konačnici sigurno predstavlja jedan značajan i fiskalni učinak i značajno poboljšanje materijalnog položaja roditelja bilo je pitanja oko stranaca prebivalište ovoga da li stranci mogu rodilje koristiti pravo dakle stranci mogu koristiti ukoliko imaju prebivalište ili stalni boravak prijavljen u
propisa i izvjeća  drugih podataka na taj način pojednostaviće se sastavljanje i podnošenje financijskih izvještaja i drugih izvješća te će ujedno se osigurati njihova objava putom informacijskog sustava nejedinstveno mjesto za se subjekte na vebstranici državnog izvornog povjerenstva,propisa izvješća i drugih podataka na taj način pojednostaviti će se sastavljanje i podnošenje financijskih izvještaja i drugih izvješća te će ujedno se osigurati i njihova objava putem informacijskog sustava na jedinstvenom mjestu za sve subjekte na web stranici državnog izbornog povjerenstva
kada govorimo o prinosima mirovinskih fondovaovlje smo čuli da oni ne postoje postoje jedna nezavisna institucija koju je neslučajno zakonom ustanovio hrvatski sabora zovese hrvatska agencija za nadvr financijskih usluga i podatke o prinosioa mirovinskih,kada govorimo o prinosima mirovinskih fondova ovdje smo čuli da oni ne postoje postoji jedna nezavisna institucija koju je ne slučajno zakonom ustanovio hrvatski sabor a zove se hrvatska agencija za nadzor financijskih usluga i podatke i prinosima mirovinskih
svatko odnas odnosno svako društvo je donijelo odluku zasebe svako društvo je definiralo cijenuko koje će ulagati u te dionice zasobe i na primjer naše društvo nije dobilo nije du dionicu končara to je dokaz da se mi nina koji način nismo dogovarali o konkretnoj transakcije znači,svatko od nas odnosno svako društvo je donijelo odluku za sebe svako društvo je definiralo cijenu po kojoj će ulagati u te dionice za sebe i npr naše društvo nije dobilo nijednu dionicu končara to je dokaz da se mi ni na koji način nismo dogovarali o konkretnoj transakciji znači
mislim da se istotako istrukture ulaganja mirovinskih fondova koju smo prezentirali jasno vidi da mirovinski fondovi nisu ni približno iskoristili mogućnosti ulaganja u ino zemljstvo znači ono što smo mi uložili u nozemstvo je puno manje od onoga što smo mogli,mislim da se isto tako iz strukture ulaganja mirovinskih fondova koje smo prezentirali jasno vidi da mirovinski fondovi nisu ni približno iskoristili mogućnosti ulaganja u inozemstvo znači ono što smo mi uložili u inozemstvo je puno manje od onoga što smo mogli
postupka uplaćen udržavni proračun iznos odo15 milijuna kuna što predstavlja za gotovo p milijuna kkuna veći iznos od sredstava koja su planira na zaac same državne komisije za tu istu godinu,postupka uplaćen u državni proračun iznos od više od 15 milijuna kuna što predstavlja za gotovo 5 milijuna kuna veći iznos od sredstava koja su planirana za rad same državne komisije za tu istu godinu
smijemo nebismo i netrebamo stedijeliti dali su dolazimo iz oporbe dakle opozicije ili zvladejuće stranke sljeve ili desne strane sabrnice odgovornosti na svima nama na svakom pojedincu našeg društva a posebi ce na sudionicima u javnom političkom gospodarskom,smijemo ne bismo i ne trebamo se dijeliti da li su dolazimo li iz oporbe dakle opozicije ili iz vladajuće stranke s lijeve ili desne strane sabornice odgovornost je na svima nama na svakom pojedincu našeg društva a posebice na sudionicima u javnom političkom gospodarskom i
kilograma radne tvari ministarstvo aktivno surađuje sa hokomihgekaon kako bi na vrijeme upozorili sve sudjenike procesa u promjenama koje su nastale i koji će se nastati provedbu n uredbe za provedbu ovog zakona nije potrebno osigurati dodatna sredstva o državnom proračunu rh,kilograma radne tvari ministarstvo aktivno surađuje sa hokom i hgkom kako bi na vrijeme upozorili sve sudionike procesa o promjenama koje su nastale i koje će nastati provedbom uredbe za provedbu ovog zakona nije potrebno osigurati dodatna sredstva u državnom proračunu rh
pitanje dakle mladih kako će oni uspjeti u svoga rada živjeti graditi budušćnost hrvatskoji i novi ovim izmenama zakona porzonadohonda kojem se za kategorije mladih d 250,pitanje dakle mladih kako će oni uspjeti od svog rada živjeti i graditi budućnost u rh i noviji novim izmjenama zakona o porezu na dohodak kojim se za kategorije mladih do 2530g
nadalje ovim se zakonom određuje novi model tržišta plina na način da će nadležnom ministarstvu su u radnji sa ho energetsko regulatornu agencijo i operatorom tržišta plina raspisati provoditi natječaj za određivanje opskrbljivača naeprodajnom tržištu plina zakon se određuje da će vlada rh nakon provedenog natječaj odlukum,nadalje ovim se zakonom određuje novi model tržišta plina na način da će nadležno ministarstvo u suradnji sa hrvatskom energetskom regulatornom agencijom i operatorom tržišta plina raspisati provoditi natječaj za određivanje opskrbljivača na veleprodajnom tržištu plina zakon se određuje da će vlade rh nakon provedenog natječaja odlukom
srodničko udomiteljstva j osiguravanje naknade za rad srodničkom udomiteljima sazadržano je dostadašnje zakonsko uređenje prema kojem se srodničkom udomitelju priznaje opskrbnina za korisnika ali ne i naknada za rad udomitelja samim time propisivanje iznosta ne može biti sadržaj,srodničkog udomiteljstva i osiguravanje naknade za rad srodničkom udomiteljima zadržano je dosadašnje zakonsko uređenje prema kojem se srodničkom udomitelju priznaje opskrbnina za korisnika ali ne i naknada za rad udomitelja samim time propisivanje iznosa ne može biti sadržaj
fondova možte vrlo lako i jednostavno vidjeti ne u našim izvješćima mošte j u našim izvješćima naravno ali i u izvješćima te nezovsne institucije a prinosi hrvatskih mirovinskih fondova realni prinosi su bili nanivo u 3z8 od početka rada govorim samo o kategoriji be koja ima već,fondova možete vrlo lako i jednostavno vidjeti ne u našim izvješćima možete i u našim izvješćima naravno ali i u izvješćima te nezavisne institucije a prinosi hrvatskih mirovinskih fondova realni prinosi su bili na nivou 38 od početka rada govorim samo o kategoriji b koja ima već
govorilo se i o perspektivama ež to je ono što također želim naglasiti znači žalba je nešto što je u ovom trenutku ni obvezujuće međutim što dovodi do skračivanja rokova ono što bi trebalo razmisliti o budućnosti možda kroz nekoliko godine o nekakvom naradnom,govorilo se i o perspektivama ežalbe to je ono što također želim naglasiti znači ežalba je nešto što u ovom trenutku nije obvezujuće međutim što dovodi do skraćivanja rokova ono što bi trebalo razmisliti u budućnosti možda kroz nekoliko godina u nekakvom narednom
dolazi i primičese ja sam se vi pozdajio  samo neke natupnice vezane za ono što smo,dolazi i primiče se ja sam sebi postavio samo neke natuknice vezano za ono što smo
dalje otvara pitanje pozicioniranja žena na tim listama često puta sune u donjem dijelu liista znase to reći da su ukrastim listama i onda kada dođemo donog konačnog podatka koliko je izabranožena oni jesu poražavajući što se tiče čelnih,dalje otvara pitanje pozicioniranja žena na tim listama često puta su one u donjem dijelu lista zna se to reći da su ukras tim listama i onda kada dođemo do onog konačnog podatka koliko je izabrano žena oni jesu poražavajući što se tiče čelnih
zahvaljuje uvaženi potpredsjedniče hrvatsog sbora poštovane saborske zastupnice i saborski zastupnici želim vam se u ime predlagatelja zahvaliti na konstruktivno raspravi te još jednom posjetiti da ovim konačnim prijedlogom zakona znači se želi ustanoviti visoko odlikovanje velereda,zahvaljujem uvaženi potpredsjedniče hrvatskog sabora poštovane saborske zastupnice i saborski zastupnici želim vam se u ime predlagatelja zahvaliti na konstruktivnoj raspravi te još jednom podsjetiti da ovim konačnim prijedlogom zakona znači se želi ustanoviti visoko odlikovanje velereda
osnovani po hrvatskom zakonodavstvu rade unjima unjima hrvati odgovaraju u hrvatskoj regulatornoj instituciji takodalje i tako dalje nema potrebe da nabrajam zemlje koji imaju ovajili onaj oblik obvezne mirovinske štednje ima ih najmanje 2etak u europi one koje,osnovani po hrvatskom zakonodavstvu rade u njima hrvati odgovaraju hrvatskoj regulatornoj instituciji itd itd nema potrebe da nabrajam zemlje koje imaju ovaj ili onaj oblik obvezne mirovinske štednje ima ih najmanje 20ak u europi i one koje
međutim taj zaposlenik može izaći iz tog sustava i poljska koja je nacionalizirala drugi mirovinski stup iz razloga proračunskih zakona i slično sad namala vrata ponovo uvodi i obveznu mirovinsku šteednju odnosnouvodi ta isti auto inroalmenti već je to na neki način postavljeno i,međutim taj zaposlenik može izaći iz tog sustava i poljska koja je nacionalizirala drugi mirovinski stup iz razloga proračunskih zakona i slično sada na mala vrata ponovno uvodi obveznu mirovinsku štednju odnosno vodi taj isti auto enrolment i već je to na neki način postavljeno i
pokazala je sigurno da je predlagati predvidio niz poboljšanja i ono što je najvažnije da sam zakon donosi veću i jasniju transparentnost rada prije svega političkih stranaka nezavisnih zastupnika ali i način prikupljenja,pokazala je sigurno da je predlagatelj predvidio niz poboljšanja i ono što je najvažnije da sam zakon donosi veću i jasniju transparentnost rada prije svega političkih stranaka nezavisnih zastupnika ali i način prikupljanja
najbržeg prsta ne želim želim živjeti u uređenoj državi to je ono što naši građani trebaju imati,najbržeg prsta ne želim želim živjeti u uređenoj državi to je ono što naši građani trebaju imati
kreirati ulagateljske pr prilike jer bi to s jedne strane bio konflikt interesa s druge strane to definitivno nije naš posao naš posao je da ulagateljske pprilike prepoznamo da ih vrednujemo da vrednujemo rizike i da temelju takvog prepoznavanja vršimo ullaganja,kreirati ulagateljske prilike jer bi to s jedne strane bio konflikt interesa a s druge strane to definitivno nije naš posao naš posao je da ulagateljske prilike prepoznamo da ih vrednujemo da vrednujemo rizike i na temelju takvog prepoznavanja vršimo ulaganja
promjena uvjeta fleksibilnosti korištenja rodilnih i roditeljskih potpora gdje zaposlenik svom poslodavcu prijavljuje fleksibilnostkorištenja naprimer u više u više,promjena uvjeta fleksibilnosti korištenja rodiljnih i roditeljskih potpora gdje zaposlenik svom poslodavcu prijavljuje fleksibilnost korištenja npr u više u više
pravobreniteljice navedena izvješća prikazuju aktivnosti rad ureda pravobraniteljice za djecu tijekom 20116. i 20 i 177. godine te sadrže cjeline po područjima koje se odnose na praćenje pojedinačnih područja prava djece mrežu mladih savjetnika i dječe,pravobraniteljice navedena izvješća prikazuju aktivnosti rad ureda pravobraniteljice za djecu tijekom 2016. i 2017. g te sadržaj cjeline po područjima koje se odnosi na praćenje pojedinačnih područja prava djece mrežu mladih savjetnika i dječje
isto se utvrđuje iza nezavisne zastupnike u cjilju jačanja transparentnosti utvrđuje se obveza nadležnog odbora hrvatskog sabora odnosno jedinica lokalne i regionalne samouprave na svojim režim straicama stranicama objave izvješća oji znasu rasporaeđenih isplaćenih sredstava,isto se utvrđuje i za nezavisne zastupnike u cilju jačanja transparentnosti utvrđuje se obveza nadležnog odbora hsa odnosno jedinica lokalne i regionalne samouprave na svojim mrežnim stranicama objave izvješća o iznosu raspoređenih i isplaćenih sredstava
