machine_generated_transcripts,original_transcript
neželim opće plaćati finu želim platiti svoj dug a koga ima želim platiti glavnicu prvo želim izaći iz tog grobstva a iz robstva može se izaći kako radom samo radom gospodarstvom koje generira hvalitetno radno plačena mjesta jer želim da građani ne,ne želim uopće plaćati finau želim platiti svoj dug ako ga imam želim platiti glavnicu prvo i želim izaći iz tog ropstva a iz ropstva može se izaći kako radom samo radom gospodarstvom koje generira kvalitetno radno plaćena mjesta jer želim da građani ne
identifikacije znači putem pina i slično ali naravno da možete dobiti podatak  o tome a ako slučano nemate ove ove podatke onda također možete putem naših kolcentara zatražiti da vamse pošla,identifikacije putem pina i slično ali naravno da možete dobiti podatak o tome ako slučajno nemate ove podatke onda također možete putem naših col centara zatražiti da vam se pošalje
što se tiče samo trajanja žalbenih postupaka tijekom 2018. godine žalbeni postupak prosječno je tnaj o 34 a računajuć d za primanja žalbpri državnoj komisiji do donošenja odluke a prosječno vrijeme rješavanja predmeta od kompletiranja dokumentacije žalbenog postupka do donošenja odluke iznosiojć4ana znači,što se tiče samog trajanja žalbenih postupka tijekom 2018. godine žalbeni postupak prosječno je trajao 34 dana računajući od zaprimanja žalbe pri državnoj komisiji do donošenja odluke a prosječno vrijeme rješavanja predmeta od kompletiranja dokumentacije žalbenog postupka do donošenja odluke iznosi je 14 dana znači
odgovarajuća razina razvijeneosveleprodajnog tržišta ostvarenje tehničkih preduvjeta za efikasno promjene opskrbljivača a plino na razini kućanstva raspoloživog prirodnog lina proizvodena u hrvatskoj sudricima na tržištu plina pod jednakim uvjetima gospodarski rast i drugo,odgovarajuća razina razvijenosti veleprodajnog tržišta ostvarenje tehničkih preduvjeta za efikasnu promjenu opskrbljivača plina na razini kućanstva raspoloživog prirodnog plina proizvedenog u hrvatskoj sudionicima na tržištu plina pod jednakim uvjetima gospodarski rast i drugo
smo se i dobro razumijeli i u ovom završnom djelojali tijekom replika jasno sam istaknula pa i zahvalila sam se svima koji su sudjela obali u raspravi jel mislim da je izuzetno važno da konstruktivno i kvalitetno rasprabaljamo oko jednomojednom ovakvom zakonu da ćemo sve primjedbe,smo se i dobro razumjeli i u ovom završnom dijelu ali i tijekom replika jasno sam istaknula pa i zahvalila sam se svima koji su sudjelovali u raspravi jer mislim da je izuzetno važno da konstruktivno i kvalitetno raspravljamo oko jednom ovakvom zakonu da ćemo sve primjedbe
godinu koje sadrži podatke o financijskom poslovanju u razvoju ljudskih potencijala anti korupcijskom dijelovanju državne komisije te naravno statističke pokazatelje rada državne komisije na samim žaltnjim postupcima izvješće sadrži i podatke o najčešćim razlozima za izjavljivanje žalbi i najčećim nepravilnostima koj je državna,godinu koje sadrži podatke o financijskom poslovanju razvoju ljudskih potencijala antikorupcijskom djelovanju državne komisije te naravno statističke pokazatelje rada državne komisije na samim žalbenim postupcima izvješće sadrži podatke o najčešćim razlozima za izjavljivanje žalbi i najčešćim nepravilnostima koje je državna
ko mi se rješavala o tom predmetu u okviru kao što znate znam da s tim nećete biti zadovoljnji u okviru žalbenih navoda i okviru službene dužnosti po koje i može postupati konkretnom postuppku međutim postoji druge institucije kojima se koje u jednom dijelu mogu odlučivati određeno nepravilnostima u postupu javne nabave a koje nisu u ovlasti,komisija je rješavala o tom predmetu u okviru kao što znate znam da s time nećete biti zadovoljni u okviru žalbenih navoda i u okviru službene dužnosti po kojoj i može postupati u konkretnom postupku međutim postoje i druge institucije koje u jednom dijelu mogu odlučivati o određenim nepravilnostima u postupku javne nabave a koje nisu u ovlasti
razloga i tijekom 20018. godine nastavila sa svojim kontinuiranim ulaganjem usavršavanjii unapređenje razine znanja svojh stručnih osoba putem o upućivanja službenika na usavršavanje napozdilopskim programima sveučilišta torvegata u rimu kao i razmjenom iskustava sa drugim žalbenim tijelima u europojui i suradnjom sa europskomu,razloga i tijekom 2018g nastavila sa svojim kontinuiranim ulaganjem u usavršavanje i unapređenje razine znanja svojih stručnih osoba putem upućivanja službenika na usavršavanje na postdiplomskim programima sveučilišta torgata u rimu kao i u razmjenom iskustava sa drugim žalbenim tijelima u eu i suradnjom sa europskom
ne uzimamosi nekakav privilegij da moramo u tom imati glavnu riječ upravo obratno mi poslujemo sukladno volji hrvatskog sabora koje definirana u ppozitivnom zakonodavstvu rh,ne uzimamo si nekakav privilegij da moramo u tom imati glavnu riječ upravo obratno mi poslujemo sukladno volji hrvatskog sabora koje je definirano u pozitivnom zakonodavstvu rh
u ovej vaše konstruktivnoj raspravi čuli smo puno otvorenih tema dosta toga što a možda i nije bilo jasno vjerujem da do drugog čitanja ćemo i mi kao predlagatelji razmotriti sve vaše prijedloge te da ćemo u drugom čitanju imat i još kvalitetniji,u ovoj vašoj konstruktivnoj raspravi čuli smo puno otvorenih tema dosta toga što vam možda i nije bilo jasno vjerujem da do drugog čitanja ćemo i mi kao predlagatelji razmotriti sve vaše prijedloge te da ćemo u drugom čitanju imati još kvalitetniji
ne prema trenutku konstituiranja predstavničkog tijela kao prema do sadašnjim išje na ovaj način osigurat će se da raspoređivanje sredsta sredstava poreznih obveznika odno sno sredsavaje izdrževnog proaračuna proračuna jedinica lokalne iregionalne samouprave u potpunosti u skladu sa rezultatima izbora,ne prema trenutku konstituiranja predstavničkog tijela kao prema dosadašnjem rješenju na ovaj način osigurat će se da raspoređivanju sredstava poreznih obveznika odnosno sredstava iz državnog proračuna i proračuna jedinica lokalne i regionalne samouprave u potpunosti u skladu sa rezultatima izbora
ovo izvjeće isto tako sadrži i djelove koji se odnose na sudsku zaštitu statistiku trajnja upravnih sporova pravo javne nabave i strukturu samih odluka upravnih sudova počeći od2018. godine visoki upravni sud rh je nadležan za odlučivanje o tužbama protiv državne komisije za kontrolu postupaka i javne,ovo izvješće isto tako sadrži i dijelove koji se odnose na sudsku zaštitu statistiku trajanja upravnih sporova o pravu javne nabave i strukturu samih odluka upravnih sudova počevši od 2018g visoki upravni sud rh postao je nadležan za odlučivanje o tužbama protiv državne komisije za kontrolu postupaka javne
uzemlji kao takve mi čaki nepolažemo pravo da takve stvari definiramo ali ćemo vrlo rado sudjelovati r u svim raspravama o mirovinskom sustavu i smatram da je to naše sudjelovanju u raspravama dobro došlo ali,u zemlji kao takve mi čak i ne polažemo pravo da takve stvari definiramo ali ćemo vrlo rado sudjelovati u svim raspravama o mirovinskom sustavu i smatramo da je to naše sudjelovanje u raspravama dobro došlo ali
pojavnost žalbi koje nemaju za cilj odnosno žalitelja i žalbi koje nemaju za cilj isključivo ostvarivanje pravne zaštite već možda nekakve druge druge ciljeve okviru samog postup,pojavnost žalbi koje nemaju za cilj odnosno žalitelja i žalbi koje nemaju za cilj isključivo ostvarivanje pravne zaštite već možda nekakve druge druge ciljeve u okviru samog postupka
znači te u veljači2 2015. godine donio odluku koje m odbija zahtjev za ocijano suglasnosti tek tada je zaprvo visoki upravni sud poćeo sa otpremom i dostavom odluka koje se odnose upravo na ovo izvještavano razdoblje znači tijekom 2018. godine traj je svoje vrsni zastoj u,znači tek u veljači 2019g donio odluku kojom odbija zahtjev za ocjenu suglasnosti tek tada je zapravo visoki upravni sud počeo sa otpremom i dostavom odluka koje se odnose upravo na ovo izvještavano razdoblje znači tijekom 2018g trajao je svojevrsni zastoj u
sredstva u državnom proračunu a u prvom čitanju na raspravi ovdje u hrvatskom saboru također su izražena i mišljenja i primjedbevezane uz zakonaravnopravnosti spolova ali oni nisu obuhvaćeni ovim izmjenama i dopunama zakona odnose se na potrebu da se,sredstva u državnom proračunu a u prvom čitanju na raspravi ovdje u hrvatskom saboru također su izražena i mišljenja i primjedbe vezane uz zakon o ravnopravnosti spolova ali oni nisu obuhvaćeni ovim izmjenama i dopunama zakona odnose se na potrebu da se
promijeniti okvire zaštititi interesz države povećati rente za,promijeniti okvire zaštititi interes države povećati rente za
dokumenta kao sastavnice programa gradnje objekata i uređaja komunalne infrastrukture koji bi se čak definirale i namjene s osnova prihoda naknade za uređenje voda a koji bi se odnosilo sukladno zakonu kojim se uređuje komunalno gospodarstvo napominje se da bi ovakao prijedlog dobeo do neučinkovitosti dlučivanje,dokumenta kao sastavnice programa gradnje objekata i uređaja komunalne infrastrukture kojom bi se čak definirale i namjene sa osnova prihoda naknade za uređenje voda a koji bi se odnosio sukladno zakonu kojim se uređuje komunalno gospodarstvo napominje se da bi ovakav prijedlog doveo do neučinkovitosti odlučivanja
hvala poštovani zastuptična pitanju u projekcijama 22 dugo godinu predviđeno je 220 milijuna kuna povećanje na razini 2e i 2. iznos o 60 miliona 60 t00a kuna mi smo kažem nakon de0 godina pri puta pristupili i povećanju snavica i,hvala poštovani zastupniče na pitanju u projekcijama za 2021 202. g predviđeno je 20 milijuna kuna povećanje na razini 2020. iznos od 160650 kuna mi smo kažem nakon 10 godina prvi puta pristupili povećanju osnovica i
spola a parlamentarni izbori prošli su pokazali nažalost iako je bio treći ciklus da većina političkih stranaka upravo se toga zakona i tih propisa nije pridržavala i vrlo kratko vezano uz neke primjedbe koje su se ticale konkretno ovih,spola a parlamentarni izbori prošli su pokazali na žalost iako je bio treći ciklus da većina političkih stranaka upravo se toga zakona i tih propisa nije pridržavala i vrlo kratko vezano uz neke primjedbe koje su se ticale konkretno ovih
odnosno donošenjem potpuno novoga zakona jer te odredbe uključuje fleksibelno radno vrijeme očinski dopust,odnosno donošenjem potpuno novoga zakona jer te odredbe uključuju i fleksibilno radno vrijeme očinski dopust
toga izradili smo mišljenje na sve preporuke i prijedloge koje smo vidjeli izvješću pravobraniteljice za djecu a sigurno da i tekako potrebna međusobna suradnja svih nadaležnih tijela institucije i pravobraniteljice kako bi položaji djece u rh bionaonoj razini na,toga izradili smo mišljenje na sve preporuke i prijedloge koje smo vidjeli u izvješću pravobraniteljice za djecu a sigurno da itekako potrebna međusobna suradnja svih nadležnih tijela institucija i pravobraniteljice kako bi položaj djece u rh bio na onoj razini na
kad uspoređujemo stopu izdvajanja kamatne stope i prinose mirovinskih fondova onda bojim se da smo u jednom trenutku pomješali 3 različite stvari znači akoje p izvajanja 5 sva izvajanja koje ulaze u mirovinskom mirovinski fond predstavljaju imovinu,kad uspoređujemo stopu izdvajanja kamatne stope i prinose mirovinskih fondova onda bojim se da smo u jednom trenutku pomiješali 3 različite stvari znači ako je stopa izdvajanja 5 sva izdvajanja koja ulaze u mirovinski fond predstavljaju imovinu
čime se potiče na pravodobno izvještavanje izvršavanje svojih obvesa,čime se potiče na pravodobno izvještavanje i izvršavanje svojih obveza
puno puno manja u startu i na početku,puno puno manja u startu i na početku
evo cijenjeni potpredceljedniče hrvatskogs uvažene zastupnice i zastupnici hrvatskoga sabora predama se znači nalazi izvješće o radu državne komisije za kontrolu postupaka javne nabave za 20018. godin državna komisija za kontrolu postupaka javne nabave samostalno je i neovisno održavno tijelo,evo cijenjeni potpredsjedniče hrvatskoga sabora uvažene zastupnice i zastupnici hrvatskoga sabora pred vama se znači nalazi izvješće o radu državne komisije za kontrolu postupaka javne nabave za 2018. godinu državna komisija za kontrolu postupaka javne nabave samostalno je i neovisno državno tijelo
izradile svoje mišljenje koje ste dobili u materijalima,izradila je svoje mišljenje koje ste dobili u materijalima
zradili i ministarstvo za demografijo obitelj mlade i socialnu politiku ministarstvo znanosti i obrazovanja ministarstvo pravosuđa ministarstvo unutarnjih poslova ministarstvo zaštite okoliša i energetike ministarsvog financija ministarstva uprave središnji e državni uredza športi uredza suzbijanje droga temeljem,izradili i ministarstvo za demografiju obitelj mlade i socijalnu politiku ministarstvo znanosti i obrazovanja ministarstvo pravosuđa ministarstvo unutarnjih poslova ministarstvo zaštite okoliša i energetike ministarstvo financija ministarstvo uprave središnji državni ured za šport i ured za suzbijanja droga temeljem
redovitog funkcioniranja preškoskog odgoja napravi od jedna mjera i ovih dana će biti potpisani i ugovori sa 706 općina u kojima se daje jdna sufinanciranje rada upravoza za rad vrtića tako da vjerujemo da upravo krozeosku perspektivu,redovitog funkcioniranja predškolskog odgoja napravi jedna mjera i ovih dana će biti potpisani i ugovori sa 76 općina u kojima se daje jedna sufinanciranje rada upravo za za rad vrtića tako da vjerujemo da će upravo kroz europsku perspektivu
sudjelovanje izdvojena područja zaštite prava djece preporuke pravobraniteljice za djecu normativne aktivnosti i straživače aktivnosti obilase ustanova za djecu i drugih mjesta ostale aktivnosti vezane za zaštitu i promicanje prava djece susrete razgovore i suradnju s djecom međunarodnu,sudjelovanje izdvojena područja zaštita prava djece preporuke pravobraniteljice za djecu normativne aktivnosti istraživačke aktivnosti obilaske ustanove za djecu i drugih mjesta ostale aktivnosti vezanih za zaštitu i promicanje prava djece susrete razgovore i suradnju s djecom međunarodnu
evo ovako ja ni približno nemam namiru iskoristiti 30 minuta za za ovo izlaganje u ovo pozndoba i pred ovako prilično praznom sabornicom ali nekoliko komentara orm moram dati u smislu,pa evo ovako ja ni približno nemam namjeru iskoristiti 30 minuta za ovo izlaganje u ovo pozno doba i pred ovako prilično praznom sabornicom ali nekoliko komentara moram dati u smislu
jesu izmjene na uvjete na priznavanje prava na osobnu invalidninu svrha ostvarivanja prava na osobnu iinvalidninu je zadovoljavanje životnih potreba za uključivanje u svakodnevni život zajednice ono što je ključno uključiti osobe cinvaliditetom na tržište rada mi kada smo,jesu su izmjene na uvjete na priznavanje prava na osobnu invalidninu svrha ostvarivanja prava na osobnu invalidninu je zadovoljavanje životnih potreba za uključivanje u svakodnevni život zajednice ono što je ključno uključiti osobe sa invaliditetom na tržište rada mi kada smo
uvijek rade neneki to nerade ali znači svaki član mirovinskog fonda pod određenim uvjetima čuvanja tajnosti znači da neko drugi neuđe u vaš mirovinski račun morate raspolagati određenim načinomm,uvijek rade neki to ne rade ali svaki član mirovinskog fonda pod određenim uvjetima čuvanja tajnosti znači da neko drugi ne uđe u vaš mirovinski račun morate raspolagati određenim načinom
godine također su ovdje zastupnici istaknuli ja bih još to ponovila el smatram da je to izuzetno važno da je vlada rh na svojoj sjednici održajnje 2.ranja 20117. godine donijela novu nacionalnu strategiju izjednačavanje mogućnosti za osobe s invaliditetom od,godine također su ovdje zastupnici istaknuli ja bih još to ponovila jer smatram da je to izuzetno važno da je vlada rh na svojoj sjednici održanoj 20. travnja 2017. godine donijela novu nacionalnu strategiju izjednačavanje mogućnosti za osobe sa invaliditetom od
stavljeno i uvršteno u ovo zajedničkoj izvješće i u pojedinačna izvješća o poslovanjima društava koja smo mi predočili,stavljeno i uvršteno u ovo zajedničko izvješće i u pojedinačna izvješća o poslovanjima društava koje smo mi predočili
učinaka u smislu skrčivanja rokova odlučivanja na što se takođe referiramo i detaljno analiziramo te podatk ke u izvješću za 2018. godinu,učinaka u smislu skraćivanja rokova odlučivanja na što se također referiramo i detaljno analiziramo te podatke u izvješću za 2018. godinu
u vašem sandučiću u e poštiregosa međutim isto tako podatke o stanju na računu se može dobiti u svakom mirovinskom društvu mirovinska društva više ne moraju kao što su morala to ranije slati pismena izvješćena sva adresa svojih članova neki to još,u vašem sandučiću u epošti regosa međutim isto tako podatke o stanju na računu se može dobiti u svakom mirovinskom društvu mirovinska društva više ne moraju kao što su morala to ranije slati pismena izvješća na sve adrese svojih članova neki to još
žeme koje su podzastupljeni spol mora biti i konseensu svih političkih stranaka i vidjeti koje model najbolji dali je to zipmodel dali je ta participacija 440 a vjerujem da nam je svima cilji da stremimog tome da nemamo kvote već da,žene koje su podzastupljeni spol mora biti i konsenzus svih političkih stranaka i vidjeti koji je model najbolji da li je to zip model da li je ta participacija od 40 a vjerujem da nam je svima cilj i da stremimo k tome da nemamo kvote već da
službeno izvješćoro računama va može dati regost i ono se nalazi,službeno izvješće o računu vam može dati regos i ono se nalazi
gospodine potpredsjedniče zahvaljujem se uvaženoj zastupnici na raspravi vrlo kratko bih intervenirala jer predpostavljam da će ukasnijim raspravama se postavljati slična pitanja najime prijedlog nacrta zakona koji je ovdje u prvom čitanju rezultatije rada,gospodine podpredsjedniče zahvaljujem se uvaženoj zastupnici na raspravi vrlo kratko bih intervenirala jer pretpostavljam da će i u kasnijim raspravama se postavljati slična pitanja naime prijedlog nacrta zakona koji je ovdje u prvom čitanju rezultat je rada
zapušljavanja i rada predmetnim izmjenama omogućuje se šira zaštita svih onih osoba koje su prijavile diskriminaciju nazočile diskriminaciji ili odbile nag za diskriminatornim postupanjem odnosno koje su na bilo koji način svjedočile u postupku,zapošljavanja i rada predmetnim izmjenama omogućuje se šira zaštita svih onih osoba koje su prijavile diskriminaciju nazočile diskriminaciji ili odbile nalog za diskriminatornim postupanjem odnosno koje su na bilo koji način svjedočile u postupku
prihode i rashode društava za upravljanje obveznim obveznim mirovinskim fondovima onda će te iznjat vidjeti da sukupni prihodi od naknada za dnu godinu na gdje između 4 i 450 milijona kuna tako da silne milijarde definitivno nisu mogle se generirati tim viš što imovina u mirovinskim fondovima bile,prihode i rashode društava za upravljanje obveznim mirovinskim fondovima onda ćete iz nje vidjeti da su ukupni prihodi od naknada za jednu godinu negdje između 40 i 450 milijuna kuna tako da silne milijarde definitivno nisu mogle se generirati tim više što je imovina u mirovinskim fondovima bila
krug korisnika imao i mogao obuhvatiti u radite vaše udruge mislim da ovdje također važno istaknuti da trenutno uslugu osobne sistenciji u hrvatskoj koristi 04780 8 osoba z za razdoblje od prije godinu i pol to je više 30 korisnika,krug korisnika imao i mogu obuhvatiti u radu te vaše udruge mislim da je ovdje također važno istaknuti da trenutno usluge osobne asistencije u hrvatskoj koristi 148 osoba za razdoblje od prije godinu i pol to je više 350 korisnika
spomenuto je bila studija koi je naše ministarstvo naručilo o ko dostupnosti pretškoskog odborja kvalitetijestavljena u ladicu mi smo doista na bazi te studije pokrenuli projekt vrtića gdje je hrvatska šuvjek i dan danas kolikoj god smo mi značajne iskorake utigodine napravile a podcjeti ću da,spomenuta je bila studija koju je naše ministarstvo naručilo oko dostupnosti predškolskog odgoja kvaliteti da je stavljena u ladicu mi smo doista na bazi te studije pokrenuli projekt vrtića gdje je rh još uvijek i dan danas kolko god smo mi značajne iskorake u 3g napravili a podsjetit ću da
tarifa za transpor linavisoka i to moramo promijeniti u budućnosti,tarifa za transport plina visoka i to moramo promijeniti u budućnosti
takosvanim profesionamim žaliteljima kao što sam reka to smo u jednom dijelu i referirali se na to izvjeću za 2018. godinu ukazali smo znači ta postoje,tzv profesionalnim žaliteljima kao što sam rekla a to smo u jednom dijelu i referirali se na to izvješće za 2018 ukazali smo znači da postoji
o ja bihsamo htijo napomenuti da,evo ja bih samo htio napomenuti da
su praktički u cijelosti osim nešto što se nalaziu novčanim fondovima ili u novcu,su praktički u cijelosti osim nešto što se nalazi u novčanim fondovima ili u novcu
milijuna kuna za korisnike diječeg doplatka dakle sada ove godine 29 tsuća djec korisi dji doplatak povećanje za 50 od prvoga srpnja 50 o više korisnika s50 isuć iše djec imaće,milijuna kuna za korisnike dječjeg doplatka dakle sada ove godine 2910 djece koristi dječji doplatak povećanje je za 50 od 1. srpnja 50 više korisnika 150 više djece imat će
živjeti ustvaranje naravno i radne perspektijve tako da evo to će biti,živjeti uz stvaranje naravno i radne perspektive tako da evo to će biti
znači ono što ć90 su ncenari mi s vojim zakonom spriječaamo i mi nedemo liberalizaciju potpunu nego izbjegavamo potpunu liberalizacijo jer novi model tržišta prin predviđa reguliranje cijene pine iz zakupceis kategorijo kućanstvo a industrija je već,znači ono što će se desit su crni scenariji mi sa ovim zakonom sprječavamo i mi ne idemo u liberalizaciju potpunu nego izbjegavamo potpunu liberalizaciju jer novi model tržišta plina predviđa reguliranje cijene plina za kupce iz kategorije kućanstvo a industrija je već
način da se ovisno o velčini odnosno o broju sanovnika utvrđuje minimalni iznos po članu predstavničkog tijela jedinice lokalne samouprave na godišnjoj razini na ovaj način će se osigurati miniman zajednički standardi uredovitom godišnje financiranje i proračune jedinica lokalne regionalne samouprave a čime će se,način da se ovisno o veličini odnosno o broju stanovnika utvrđuje minimalni iznos po članu predstavničkog tijela jedinice lokalne samouprave na godišnjoj razini na ovaj način će se osigurati minimalni zajednički standardi u redovitom godišnjem financiranju iz proračuna jedinica lokalne regionalne samouprave a čime će se
plina d9 što setiče ugljikovodika i novih eksplaltacijskih polja u h i onošta smo napravili idemo u smjeru novog zakona ogljikovodicima rhj koji će bitno,plina deveto što se tiče ugljikovodika i novih eksploatacijskih polja u hrvatskoj ono što smo napravili idemo u smjeru novog zakona o ugljikovodicima u rh koji će bitno
uvjete kako mogu trošiti svojam financijska sredstva a ovdje samo zabranjujemo da referendum se ne može financirati od onih korisnika znači iz državnog proračuna kao niti znači dio političkih stranaka nema razlike u dijelu financiranja zači za političke stranke i,uvjete kako mogu trošiti svoja financijska sredstva a ovdje samo zabranjujemo da referendum se ne može financirati od onih korisnika znači iz državnog proračuna kao niti znači dio političkih stranaka nema razlike u dijelu financiranja znači za političke stranke i
sigurnost opskrb i ciena bude što obolja ove mjere 10 ma će to garantirati ne možemo znati što će biti u budućnosti sad cenaaplina na euopskom i svjetskom tržištu e proizvodnje u hrvatskoj padaju vrijeme na jadranu i želimo time,sigurnost opskrbe i cijena bude što bolje a ove mjere deset mjera će to garantirati ne možemo znati što će biti u budućnosti sa cijenama plina na europskom i svjetskom tržištu cijene proizvodnje u hrvatskoj pada na jadranu i želimo time
slabje razijenih općina i gradova i kro fond fiskalnog izravnanja to je vrlolako moguše vijeti kroz izrještajea financijske etih jedinica koliko su značajno osnažili i naravno jedan dio u smjerli u demogravsku politiku na svojim područjima na čemu evo doista držimodosučinjeni,slabije razvijenih općina i gradova i kroz fond fiskalnog izravnanja to je vrlo lako moguće vidjeti kroz izvještaje financijske tih jedinica koliko su značajno osnažili i naravno jedan dio usmjerili i u demografsku politiku na svojim područjima na čemu evo doista držimo da su učinjeni
pitanje samog statuta i statuta o financiranju političkih stranaka i nezavisnih zastupnika na koje račun se uplaćuju sredstva znači za redovito godišnje financiranje ali opet kažem ovo ubite nije najmetprema jedinicama lokalne samouprave nego evo upravo znaći sredstva za rad članova,pitanje je samog statuta i statuta o financiranju političkih stranaka i nezavisnih zastupnika na koji račun se uplaćuju sredstva za redovito godišnje financiranje ali opet kažem ovo u biti nije namet prema jedinice lokalne samouprave nego je ovo upravo sredstva za rad članova
