machine_generated_transcripts,original_transcript
oslobađaju porezana dohodak jedan je snažni doprinos iskorak i upravo posljećenosti ove vlade da osobito mladima da dodatnu vga poticaj za ostanak ja bih reko i povratak a kaže mi kroz izmjene zakona koje su predviđeli smanjeni,oslobađaju poreza na dohodak jedan je snažni doprinos i iskorak i upravo posvećenost i ove vlade da osobito mladima da dodatnu ovoga poticaj za ostanak ja bi reko i povratak a kažem i kroz izmjene zakona koje su predviđeli smanjeni
životu koja govori o 4 neprenosiva mjeseca po roditelju 4 neprenosiva mjeseca za roditeljski doput sa svakog roditelja uz 2v neprenosia mjesa dakle mi to imamo sa direktivom u potpunosi usklađenove nana što če reći da u tome djelu smo iznateuopskogo,životu koja govori o četiri neprenosiva mjeseca po roditelju četiri neprenosiva mjeseca za roditeljski dopust svakog roditelja uz dva neprenosiva mjeseca dakle mi tu imamo sa direktivom u potpunosti usklađeno već danas što će reći da u tome dijelu smo iznad europskog
čuli ministarstvo pripreme prijedlog zakona koji će to na odgovarajući načinregulirati čuli smo isto tako različite brojke vrlo čudne broj  naknadama mirovinskih fondova spominjalo se 78 pa se spominjalo o nekakvih da pogladam još jednom,čuli ministarstvo priprema prijedlog zakona koji će to na odgovarajući način regulirati čuli smo isto tako različite brojke vrlo čudne brojke o naknadama mirovinskih fondova spominjalo se 7 8 pa se spominjalo nekakvih da pogledam još jednom
evo to jevrlo jasna činjenica al činjenica kj koja nije zataje na nego koja je vrlo jasno napisana u našim izvješćim toliko naknadao ja moram reći da ipak mirovinska društva ne mogu sama,evo to je vrlo jasna činjenica ali činjenica koja nije zatajena nego koja je vrlo jasno napisana u našim izvješćima toliko o naknadama ja moram reći da ipak mirovinska društva ne mogu sama
koji ulaze svi oni koji samina donesu odluku izboru kategorije mirivinjskog fonda međutim sa podacijom bi započeo  vezano za mirovinske fond kategorije a koj je namijenjen našim mlađim članovima što se tiče strukture ulaganja unjemuje najviše relativno,koji ulaze svi oni koji sami donesu odluku o izboru kategorije mirovinskog fonda međutim sa podacima bih započeo vezano za mirovinski fond kategorije a koji je namijenjen našim mlađim članovima što se tiče strukture ulaganja u njemu je najviše relativno
smo veći u pilotu euopske komisije mi ovim zakonom deregulacija i mi ovim zakonom želimo to spriječiti,jer smo već u pilotu europske komisije mi ovim zakonom deregulacija i mi ovim zakonom želimo to spriječiti
treći alatrukama ove vlade koji će zasigurno napraviti koji je jedan također najvažniji za budućnost neki su kratkoročni neki su dugoročni rekao biz ovaj da je srednjeročni tojelenđi terminal,treći alat u rukama ove vlade koji će zasigurno napraviti koji je jedan od također najvažniji za budućnost neki su kratkoročni neki su dugoročni rekao bi za ovaj da je srednjoročni to je lng terminal
ideseta mjera rh jedini realni partner bih ergni pinifikaciji pomoćemo našim susjedima o bihero plinifikaciji bihrcge njihovih postrojenja na taj način ćemo osigurati da rh nije samo,i deseta mjera rh je jedini realni partner bih u plinofikaciji i pomoći ćemo našim susjedima u bih u plinofikaciji bih i njihovih postrojenja na taj način ćemo osigurati da rh nije samo
isto tako želim govoriti ne dosmisleno i javno ne samo protiv ove vlade nego piovog pogrešnog sustava mi danas imamo pogrešan sustav,isto tako želim govoriti nedvosmisleno i javno ne samo protiv ove vlade nego protiv ovog pogrešnog sustava mi danas imamo pogrešan sustav
irsku u japan veliku britaniju ili bilogdje u svijet rimaju takva znanja i takavnivo obrazovanja uzkoji to ide hvala,u irsku u japan u veliku britaniju ili bilo gdje u svijetu jer imaju takva znanja i takav nivo obrazovanja uz koji to ide hvala
vlasništvo rh to je proces koji je prednama mi smo donijeli političku odluku idemo u tom smjeru jednom kad vratimo inu u naše vlasništvo više nećemoiti opterećeni gdje će za i završiti pi nego će moći sami upravljati s tim procesima,u vlasništvo republike hrvatske to je proces koji je pred nama mi smo donijeli političku odluku i idemo u tom smjeru jednom kad vratimo inau u naše vlasništvo više nećemo biti opterećeni gdje će završiti plin nego ćemo moći sami upravljati s tim procesima
omogućiti na idućim lokalnim izborima jer netko ovdje postavio pitanje to će upravo biti taj treći izborni ciklus ove godine u svibnju da imamo i uvjećima u gradovima općinama i na županijama participaciju od 40 odzastupljenog,omogućiti na idućim lokalnim izborima jer ovdje je netko postavio pitanje to će u pravo biti taj treći izborni ciklus ove godine u svibnju da imamo i u vijećima u gradovima općinama i na županijama participaciju od 40 podzastupljenog
djecu koja je jedna od niz pronatalitetnih mjera koje predlaže naše ministarstvo i smatram da smo svi ovdje suklasni da je itekako važno što u smislu demograke obnove hrvatske ali i rješavanja problema od rizika od ciromaštva i socijalne,djecu koja je jedna od nizu pronalatitetnih mjera koje predlaže naše ministarstvo i smatram da smo svi ovdje suglasni da je itekako važno što u smislu demografske obnove hrvatske ali i rješavanja problema od rizika od siromaštva i socijalne
jednim dijelom i odgovora na postavljena pitanja jednim dijelom razješnjavanja ovi stvari da se javim me ponukao poštovani saborski zastupnik pernar kkoji nažalost nije ovdje a ja radi nekakvog objektivnog informiranja javnosti,jednim dijelom i odgovora na postavljena pitanja jednim dijelom razjašnjavanja ovih stvari da se javim prvo me ponukao poštovani saborski zastupnik pernar koji na žalost nije ovdje a ja radi nekakvog objektivnog informiranja javnosti
želim vam s posjetit da je zakon o financiranju političkih aktivnosti i izborne prodmižbe osupanje na snagu osnovnog teksta zakona,želim vas podsjetiti da je zakon o financiranju političkih aktivnosti i izborne promidžbe od stupanja na snagu osnovnog teksta zakona
dozvoljenih troškova izborne promežbe po kandidacijskim listama ne izborima za članove eupsg parlamenta iz rh sa do sadašnjih milione 50 tisuća kuna na 43 milijuna kuna procjenjujući da do sadašnji dozvoljeniiznos s obzirno na značajovih izbora nije u razmjeru sa ukupnim odozvoljenim,dozvoljenih troškova izborne promidžbe po kandidacijskim listama na izborima za članove europskog parlamenta iz rh sa dosadašnjih 150 kuna na 40 kuna procjenjujući da dosadašnji dozvoljeni iznos s obzirom na značaj ovih izbora nije u razmjeru sa ukupno dozvoljenim
pristupi izrazdi cjelovitog zakonskog uređenja kao temeljnog temeljenog nadetljnnalizi stanja u području koje zakon o ravnopravnosti spolova regulira odnosno da se priispita mogućnost kvalitetnijek normativnog rješenja koje bi pri donjelo višem stupnju zaštite o,pristupi izradi cjelovitog zakonskog uređenja kao temeljenog na detaljnoj analizi stanja u području koje zakon o ravnopravnosti spolova regulira odnosno da se preispita mogućnost kvalitetnijeg normativnog rješenja koje bi pridonijelo višem stupnju zaštite o
je upravljalo odnosno i sad upravljaiali stanje u tom trenutku oncem prošle godine je bilo 26 milijardi kuna znači naš društvo upravlja se 26 milijardi kuna u obveznim mirovinskim fondovima među njima je daleko,je upravljalo odnosno i sad upravlja ali stanje u tom trenutku koncem prošle godine je bilo 26 milijardi kuna znači naše društvo upravlja sa 26 milijardi kuna u obveznim mirovinskim fondovima među njima je daleko
brigeokonavoročenog djeteta između oca i majke u članku 40stavku 2 dodaje se zamjenjuje se dio koju se odnosi na,brige oko novorođenog djeteta između oca i majke u članku 47. stavku 2. dodaje se zamjenjuje se dio koji se odnosi na
primjer epke uje odnosno istaknuto je 8  država članica bilježilo je porazboa stanovnika međutim uz poveće porazboa starovnika za biljeđenje prije svega zbog migracija u europ1. godine dosjelo nekih 3 milijuna 22500 starovnika ali istovremeno je o,primjer eu odnosno istaknuto je da 18 država članica bilježilo je porast broja stanovnika međutim povećan porast broja stanovnika zabilježen je prije svega zbog migracija u europu je 18g doselilo nekih 3 milijuna i 25 tisuća stanovnika ali istovremeno je od
socijalnih naknada zajmćenu minimalnu naknadu jednokratnu naknadu javljamo i raspisujemo natjećaj iz  fonda europske pomoći iza najpotrebitije kojim se osigurava školska prehrana za svu djecu koja su u riziku osiromaštva i koje roditelji nemogu osigurati obroku školama,socijalnih naknada zajamčenu minimalnu naknadu jednokratnu naknadu javljamo i raspisujemo natječaje iz fonda europske pomoći za najpotrebitije kojim se osigura školska prehrana za svu djecu koja su u riziku od siromaštva i koje roditelji ne mogu osigurati obrok u školama
posedice na zdravlje ljudi i okolišu,posljedice na zdravlje ljudi i okoliš
očitovali a to je vezano na primjez izmjene i dopune zakona o socijalnoj skrbi koje u javnoj raspravi u kontekstu poboljšanja zaštite osoba s invaliditetom tim izmjenama i dopunama predvića se mogućnost ostvarivanja prava na status nje govatelja pračnom ili izvan pračnom,očitovali a to je vezano na primjer izmjene i dopune zakona o socijalnoj skrbi koje je u javnoj raspravi u kontekstu poboljšanja zaštite osoba sa invaliditetom tim izmjenama i dopunama predviđa se mogućnost ostvarivanja prava na status njegovatelja bračnom ili izvanbračnom
dobrovoljnih zatvorenih i 3 obvezna mirovinska fonda koje su zapravo predmetog izvješća sukladno zakona aši društve ima kapital od 143 milijuna kuna u  jamstvenom poologu u ovom trenutku ima 637 milijuna kuna društvu,dobrovoljni zatvorenih i 3 obvezna mirovinska fonda koja su zapravo predmet ovoga izvješća sukladno zakonu naše društvo ima kapital od 143 milijuna kuna u jamstvenom pologu u ovom trenutku ima 67 milijuna kuna društvo
prijedlog ne samo zakona o ravnopravnosti spolova već i mnogih drugih propisa i zakona koje bi trebalo uskladiti kako bi smo postigli glavni cilj a to je bolja zastupljenost i participacija žena kako na lokalnoj razini u političkom životu tako i ovdje u,prijedlog ne samo zakona o ravnopravnosti spolova već i mnogih drugih propisa i zakona koje bi trebalo uskladiti kako bismo postigli glavni cilj a to je bolja zastupljenost i participacija žena kako na lokalnoj razini u političkom životu tako i ovdje u
postojati stručni nazor i tijelo koje će provoditi priznavanje takvih diploma i to je ministarstvo nadležno ministarstvo znanosti i obrazovanje i agencija za odgo ie obrazovanje,postojati stručni nadzor i tijelo koje će provoditi priznavanje takvih diploma i to je ministarstvo nadležno ministarstvo znanosti i obrazovanja i agencija za odgoj i obrazovanje
poznato ako se netko rodio taj rodni listreba biti dostupan onim drugim servisima koji bi to potvrđivao a ne da opet naši građani hodaju od šaltara doš altera i dokazuju ono što je opće poznata činjenica,poznato ako se je netko rodio taj rodni list treba biti dostupan onim drugim servisima koji bi to potvrđivao a ne da opet naši građani hodaju od šaltera do šaltera i dokazuju ono što je opće poznata činjenica
sljedniče uvažene zastupnice zastupnici zahvaljujem vam se također na sudjelovanju u raspravu naime ovo je konačni prijedlog zakona o prvedbi konvencije i ono što je ovdje važno istaknuti to je ste odgovoriti na neka pitanja koja su se pojavila u raspravama naime rh,predsjedniče uvažene zastupnice i zastupnici zahvaljujem vam se također na sudjelovanju u raspravi naime ovo je konačni prijedlog zakona o provedbi konvencije i ono što je ovdje istaknuti tj odgovoriti na neka pitanja koja su se pojavila u raspravama naime rh
hvala lijepa pokuša ću biti tokrći i koncizniji znači htije bizložiti šta mi radimo zaprave koji je naš akcijski plan da obuzamo tržište plina kao sa malo prinaveo poratakine u hrvatsko vlastištvo sa to kalitetnijim financijskim okviron koji neće utjecati na,hvala lijepa pokušat ću bit što kraći i koncizniji znači htio bih izložiti šta mi radimo zapravo i koji je naš akcijski plan da obuzdamo tržište plina kako sam malo prije naveo povratak inae u hrvatsko vlasništvo sa što kvalitetnijim financijskim okvirom koji neće utjecati na
obvezna mirovinska štednja šta je drugi stup da li jes stu drugi stup štednja ili nije da apsolutno,obvezna mirovinska štednja šta je drugi stup da li je drugi stup štednja ili nije da apsolutno
i to je zapravo onaj okviruoje u kojem mi djelujemo i dok je to tako i mićemo ulagati svoje najbolje napore u interesu naših članova a kažem u okviru svega onoga što je zadano hrvatskim zakonodavstvu,i to je zapravo onaj okvir u kojem mi djelujemo i dok je to tako i mi ćemo ulagati svoje najbolje napore u interesu naših članove a kažem u okviru svega onoga što je zadano hrvatskim zakonodavstvom
razvija,razvija
oko 2 i d što ustvari da je odgovorr na pitanje dali se žene žele baviti politikom da žele se ima ih članstva u političkim strankama dokazuju da otprilika od371o 40 upravo čine žene a samim time što je neko pristupio,oko 29 što u stvari daje odgovor na pitanje da li se žene žele baviti politikom da žele se i ima ih članstva u političkim strankama dokazuju da otprilike od 30 do 40 upravo čine žene a samim time što je netko pristupio
tableti puniti u školi kako će oni učenici koji kotkuće nemaju ni struje zapravo pristupati i digitalnom sadržaju,tableti puniti u školi kako će oni učenici koji kod kuće nemaju ni struje zapravo pristupati digitalnom sadržaju
jedinice lokalne samouprave izvajale dosnovno ednu kunu za jednog člana predstavničkog tijela na godišnoj razini do nekih koji su to nči izvajali značajno većem iznosu na ovaj način propisujemo obbvezu kako bi upravodna članovi predstavničkog tijela mogli imat,jedinice lokalne samouprave izdvajale doslovno 1 kn za jednog člana predstavničkog tijela na godišnjoj razini do nekih koji su to znači izdvajali u značajnoj većem iznosu na ovaj način propisujemo obvezu kako bi upravo članovi predstavničkog tijela mogli imati
bilo u prošloj godini ulzr13 poji kaod govorimo o naknadama naknada će se i dalje smanjivati sukladno zakon neću komentirati izj ovi fondovi nisu nisu hrvatski definitivno jesu,bila u prošloj godini 03 i kada govorimo o naknadama naknade će se i dalje smanjivati sukladno zakonu neću komentirati da ovi fondovi nisu hrvatski definitivno jesu
uvaženi saborski zastupniče to nije pitanje samog čelnika to je pitanje samih građana hoćali se o dasvaltom referendumu hoćali ga podržat i kakav će dati zakon je jasno nači predvidio reguliranje financiranja referenduma sukladno nači veličini jedinice lokalne samo upa,uvaženi saborski zastupniče to nije pitanje samog čelnika to je pitanje samih građana hoće li se odazvati tom referendumu hoće li ga podržati i kakav će dati zakon je jasno znači predvidio reguliranje financiranja referenduma sukladno znači veličini jedinice lokalne samouprave
28 sžalbenih predmeta započesti su izjarljivanjem žalbe u obliku elektroničkim putem u obliku elektroničke ža,28 žalbenih predmeta započeti su izjavljivanjem žalbe u obliku elektroničkim putem u obliku elektroničke žalbe
trebaju novijauti ona ih nauči naruči a kada treba provesti nešto znači da digitalizira usluge da se zna red jer građani žele živjeti uređenoj državi onda zato godine prolaze a ništa se ne događa hhvala,trebaju novi auti ona ih naruči a kada treba provesti nešto znači da digitalizira usluge da se zna red jer građani žele živjeti u uređenoj državi onda zato godine prolaze a ništa se ne događa hvala
srdstava danas na sjednici c fonda za rh 1o je 150 milijuna je ura besporatnog granta znači imamo rezultate u 2 mjeseca preorenui smo imou izu znamo šta radimo ovi zakon koji donosimo želimo da ovladamo tržište nplina nejš kalitetniji način da našim građanima,sredstava danas na sjednici cef fonda za rh to je 150 milijuna eura bespovratnog granta znači imamo rezultate i u dva mjeseca preokrenuli smo i znamo što radimo ovaj zakon koji donosimo želimo da ovladamo tržištem plina na još kvalitetnije način da našim građanima
moram primjetiti da  jenegdje jedno5.ak puta rekao da je stopa naknadne mirovinskih fondova 3 5 što apsolutno nije točno i ne odgovara istine  vrlo jasno je napisano u našim izvješćima značistopa,moram primijetiti da je on negdje jedno petnaestak puta rekao da je stopa naknade mirovinskih fondova 3 i pol posto što apsolutno nije točno i ne odgovara istini vrlo jasno je napisano u našim izvješćima znači stopa
zastupnice isticali da je pravobraniteljica imala mnoštvo prigovora one je dala pozitivno mišljenje na odredbu vezano uz ove izmjene i dopune i to je jasno rekla i na odboru za ravnopravnospolova evo vezano u z tu primjedbu i zaključila bih ovo,zastupnice isticali da je pravobraniteljica imala mnoštvo prigovora ona je dala pozitivno mišljenje na odredbu vezano uz ove izmjene i dopune i to je jasno rekla i na odboru za ravnopravnost spolova evo vezano uz tu primjedbu i zaključila bih ovo
dakle rekli smo da će direktiva u usklđivanju bitejskog posnog života koja je donesen lipnjuu prošle godine i implementacijskei rokije do kolovo z220 druge intencija je da sn jedno državi članici do sadašnije donesena ali da mi to učinimo dakle cjelovitim izmjenama,dakle rekli smo da će direktiva o usklađivanju obiteljskog i poslovnog života koja je donesena u lipnju prošle godine i implementacijski rok je do kolovoza 202 intencija je da s obzirom da ni u jednoj državi članici do sada još nije donesena ali da mi to učinimo dakle cjelovitim izmjenama
rosk,prosjeka
tako zana povelja lokalnaoj samoupravi koja se temelje na 2 temelja načela to su načelo supsidijarnosti i solidarnosti vlade je svoju solidarnust pokazali novim zakonom o financiranju jedinica lokalne područje samouprave 2018. godine kojim je značajno pobojšala kapacitete fiskalne svih osobito,takozvana povelja o lokalnoj samoupravi koja se temelji na dva temeljna načela to su načelo supsidijarnosti i solidarnosti vlada je svoju solidarnost pokazala i novim zakonom o financiranju jedinica lokalne područne samouprave u 2018. godini kojim je značajno poboljšala kapacitete fiskalne svih osobito
te stupanje na snagu prvog dana od dana objavju narodnim novinama da bi se moglo pristupiti izradi odlikovanja velrda predsjednika rranji tužmana te da bi se mogao provesti odgovarajući psuaostupak vezano za dodjelu odlikovanja kako bi se omogućilo da prva dodjela odlukovanja bude upriličena 10,te stupanje na snagu prvog dana od dana objave u narodnim novinama da bi se moglo pristupiti izradi odlikovanja velereda predsjednika republike franje tuđmana te da bi se mogao provesti odgovarajući postupak vezano za dodjelu odlikovanja kako bi se omogućilo da prva dodjela odlikovanja bude upriličena 10.
nepravilnosti i u ovom samom izvješću za 2018. godinu dana je opčenju tocijna stanja u javnoj nabavi dane su dane su i odrežene preporuke u tom dijelu i vezano za spominjanje takozvnih profesionalni žalitelja j u samom izvješću se daje napomena o tome da je uočeno da postoje,nepravilnosti i u ovom samom izvješću za 2018. godinu dana je općenito ocjena stanja u javnoj nabavi dane su dane su i određene preporuke u tom dijelu i vezano za spominjanje tzv profesionalnih žalitelja i u samom izvješću se daje napomena o tome da je uočeno da postoje
proračunataoda ne smijemo u tim postupcima naravno uvijek trebamo težiti što bržem rješavanju i u tome smo govorili i u samom izvješću međutim to brzo rješaovanje ni kada ne smije biti uštrup kvalitete pogotovo u postupcima koji se financiraju iz europskih fondoa govorilo se i o,proračun tako da ne smijemo u tim postupcima naravno uvijek trebamo težiti što bržem rješavanju i o tome smo govorili i u samom izvješću međutim to brzo rješavanje nikada ne smije biti na uštrb kvalitete pogotovo u postupcima koji se financiraju iz europskih fondova govorilo se i o
zakonom se otvara mogućnost uvođenja prijelaznog razdoblja u kojem bi vele prodajena komponenta krajne cjene plina za kućanstva ostala regulirana zakonm se stvaraju uvjeti za normalno funkcioniranje tržišta plina u hrvatskoj stoga je nužno ovaj zakon donijeti pohitnom postupku,zakonom se otvara mogućnost uvođenja prijelaznog razdoblja u kojem bi veleprodajna komponenta krajnje cijene plina za kućanstva ostala regulirana zakonom se stvaraju uvjeti za normalno funkcioniranje tržišta plina u hrvatskoj stoga je nužno ovaj zakon donijeti po hitnom postupku
ostvarili upravo oni gradovi i općine koj imaju najveće prihode dok bi se općinoma i gradovima smanjeim brojin stanounika moglo dogoditi da se sustavi zaštite od štetnog djelovna voda obrana od poplave zbog nedostatnosti sredta općine izgrade vezano uz prijedlog o uvođenju novog planskog programa,ostvarili upravo oni gradovi i općine koji imaju najveće prihode dok bi se u općinama i gradovima s manjim brojem stanovnika moglo dogoditi da se sustavi zaštite od štetnog djelovanja voda obrana od poplave zbog nedostatnosti sredstava uopće ne izgrade vezano uz prijedlog o uvođenju novog planskog programa
kulturnom životu rh,kulturnom životu rh
ujedno predloženim nacrtom prijedloga zakona predviđeno je dodavanje novog članka jedana kako bi se u zakonskom tekstu naveli svi akti eua uije s kojima se usklađuju odredbe zakona o ravnopravnosti spolova hvala lijepa na pažni,ujedno predloženim nacrtom prijedloga zakona predviđeno je dodavanje novog članka 1a kako bi se u zakonskom tekstu naveli svi akti eu s kojima se usklađuju odredbe zakona o ravnopravnosti spolova hvala lijepa na pažnji
kraju pd godina te se ntimene isključuje djecu koja bohaćuju peto godišnje programe školovanja nadalje zakonom se omogućava da pravo na doplatak a djecu pripada od dana rođenja a ne od dana podnošenja zahtjeva za doplatak za djecu kakoj je propisano važećim zakonom procjenjeno je da će u odnosu,traju pet godina te se time ne isključuje djecu koja pohađaju petogodišnje programe školovanja nadalje zakonom se omogućava da pravo na doplatak za djecu pripada od dana rođenja a od dana podnošenja zahtjeva za doplatak za djecu kako je propisano važećim zakonom procijenjeno je da će u odnosu
te posebno je važan podatak da će upravo nakon izglasavanja u hrvatskom saboru od crpnja 50 imati više korisnika više ljudi i više djece pravo na dječi doplatak u rh za kojeg su proračunska sredstva predviđena kao što,te posebno je važan podatak da će upravo nakon izglasavanja u hrvatskom saboru od srpnja 50 imati više korisnika više ljudi više djece pravo na dječji doplatak u rh za kojeg su proračunska sredstva predviđena kao što
određeno ukupnom godišjoj razini neovrsno radili se o donacijama za redovito godišnje financiranje ili za odonacijama za financiranje izborne promičve,određeno u ukupnom godišnjoj razini neovisno radi li se o donacijama za redovito godišnje financiranje ili za o donacijama za financiranje izborne promidžbe
istaknuti jedna kontinuirana dbra i partnerska suradnja sapravobraniteljicom za osobe s invaliditetom i vjerujem da će i ta udruga moći dobro i kvalitetno prijaviti programe i projekte što iz domaćih nacionalnih sredstava ali i sredstava epuje kako bi se što širi,istaknuti jedna kontinuirana dobra i partnerska suradnja zapravo pravobraniteljice za osobe sa invaliditetom i vjerujem da će i ta udruga moći dobro i kvalitetno prijaviti programe i projekte što iz domaćih nacionalnih sredstava ali i sredstava eua kako bi se što šiti
sudbini zahvaljujućih raprim i promišljenim djelovanjem predsjednika tuđmana u nepovoljnim okolnostima tijekom p1rvih godina hr samostalnosti u vrijeme agresije na ht i domiovinskom rau rh izašla je zrata kao povjednička država sa jasnom vizio,sudbini zahvaljujući hrabrim i promišljenim djelovanjem predsjednika tuđmana u nepovoljnim okolnostima tijekom prvih godina hrvatske samostalnosti u vrijeme agresije na hrvatsku i domovinskom ratu rh izašla je iz rata kao pobjednička država sa jasnom vizijom
imali deflacijo u izvornom izvješću znači neovom sračnom nego i izbornom izvješću nalaza se detaljnije podaci o investiciijkoj  investiciskim limitima o zemljopisnoj strukturi ulaganja o djelatnosti povalutama i slično,imali deflaciju u izvornom izvješću znači ne u ovom skraćenom nego izvornom izvješću nalaze se detaljniji podaci o investicijskim limitima o zemljopisnoj strukturi ulaganja u djelatnosti po valutama i slično
prinos koji je ostvaren u 2016. godini je725 realno istopreko 7 a od početka rada znači oded2011. godine prinos fonda iznosio prosječno 8 z8 ili reaalno 8 zz 55 zbog toga što smo,prinos koji je ostvaren u 2016. godini je 725 realno isto preko 7 a od početka rada znači od te 2014. godine prinos fonda je iznosio prosječno 858 ili realno 895 zbog toga što smo
životu nego općenito u društvenom životu kulturnom životu gospodarskom životu,životu nego općenito u društvenom životu kulturnom životu gospodarskom životu
