machine_generated_transcripts,original_transcript
zahtjevima europske komisije u odnosu na direkdirektivu europskog parlamenta i vijeća od 5 srpnja 206 godine zahvaljujem se na podršci svima koji su raspravljali i na samomekraju vezano uz ratifikaciju istambolske konvencije,zahtjevima europske komisije u odnosu na direktivu europskog parlamenta i vijeća od 5. srpnja 206. godine zahvaljujem se na podršci svima koji su raspravljali i na samome kraju vezano uz ratifikaciju istambulske konvencije
i sad evo završno nadeočito nema ja smatram da nade ima i da sve ove mjere koje radimo pa i ovim zakonom nisu ni demogravska prekretnica ali je jedan značajan doprinos iskoras u stvaranju upravo o perspektive izbora i boljih uvjeta za roditelje zamajke oćeve,i sad evo završno nade očito nema ja smatram da nade ima i da sve ove mjere koje radimo pa i ovim zakonom nisu ni demografska prekretnica ali je jedan značajan doprinos iskoraku stvaranju upravo perspektive izbora i boljih uvjeta za roditelje za majke očeve
transparentnosti cijelog sustava javne nabave tijekom 2018. godina držav na ko misija ob obilježilaje 1.u odišnjih surada koja je obilježena međunarnom konferencijom koja je okupila renomirane stručnjeke na području javne nabave iz rh tinozemstva kao i predstavnike akadems,transparentnosti cijelog sustava javne nabave tijekom 2018g državna komisija obilježila je 15tu godišnjicu rada koja je obilježena međunarodnom konferencijom koja je okupila renomirane stručnjake na području javne nabave iz rh te inozemstva kao i predstavnike akademske
biti podložno provjeri a isto tako trebalo bi osiguravati jednake prilike svima tako dapeliramo još jednom ovim putem prema hrvatskoj javnosti da j ova obrazovna reforma izuzetno nepripremnjena da djeci ne garantira jednake prilike i da ćemo biti izloženi,biti podložno provjeri a isto tako trebalo bi osiguravati jednake prilike svima tako da apeliramo još jednom ovim putem prema hrvatskoj javnosti da je ova obrazovna reforma izuzetno nepripremljena da djeci ne garantira jednake prilike i da ćemo biti izloženi
ravnopravnospolova aktom od 30t kožuka 2017. godine navedeno izvješće prikazuje aktivnosti rad ureapravobraniteljice za ravnopravnostpolova tijekom 20117. godine te sadržiceline po područjima koje se odnose na zapošljavanje rad obite,ravnopravnost spolova aktom od 30. ožujka 2018. godine navedeno izvješće prikazuje aktivnosti i rad ureda pravobraniteljice za ravnopravnost spolova tijekom 2017. godine te sadrži cjeline po područjima koje se odnose na zapošljavanje i rad obitelj
također uređuje se da članu predstavničkog tijela i zabranom saliste grupe birača koja nije otvorio poseban račun za redovito godišnje financiranja u propisanom roku jedinica lokalne i regionalne samouprave nije dužna isplatiti sredstva za razdoblje u kojim posebni račun nije bio otvore,također uređuje se da članu predstavničkog tijela izabranom sa liste grupe birača koji nije otvorio poseban račun za redovito godišnje financiranje u propisanom roku jedinica lokalne i regionalne samouprave nije dužna isplatiti sredstva za razdoblje u kojem posebni račun nije bio otvoren
iznosili tijekom rasprave da je upravo na zadnjim lokalnim izborima od 4706 nog kandidata koju smo imalni na listama što za vjeća mjesnih gradskih odbora iz županijskih skupština participacija žena je bila 417 ali tu se naravno,iznosili tijekom rasprave da je upravo na zadnjim lokalnim izborima od 47601 kandidata koji smo imali na listama što za vijeća mjesnih gradskih odbora i županijskih skupština participacija žena je bila 417 ali tu se naravno
godinu koje predsjedniku hrvatskog sabora podnjala pravobraniteljica za osobe s invaliditetom aktom od 30 1.g ožujka 201117. godine navedeno izvješće prikazuo aktivnosti rad u reda pravobraniteljice za osobe s invaliditetom te daje preglet podataka o prijavljenim povredama,godinu koje je predsjedniku hrvatskog sabora podnijela pravobraniteljica za osobe s invaliditetom aktom od 31. ožujka 2017. godine navedeno izvješće prikazuje aktivnosti i rad ureda pravobraniteljice za osobe s invaliditetom te daje pregled podataka o prijavljenim povredama
za sam referendum a što se tiče samih ugovora do 5 t0 od 5 tis0uća kuna smatram da je to transparentno i na taj način jasno definiramo svakog donatora i sutravno informacijskom sustavu jasno možemo znači pregledavati vidim daje to danas bila značajna,za sam referendum a što se tiče samih ugovora od 5 tisuća kuna smatram da je to transparentno i na taj način jasno definiramo svakog donatora i u informacijskom sustavu jasno možemo znači pregledavati vidim da je to danas bila značajna
rezultati ne mogućnosti i zapravo ne imanja pravih mogućnosti ulaganja u druge oblike im imovine u hrvatskoj na zadovoljavaju ćemnivou i nivo ulaganja u hrvatske državne obveznice u relativnom omjeru ne u apsolutnoma li u relativnom omjeru u budućnosti sćee definitivno,rezultat i nemogućnosti zapravo ne imanja pravih mogućnosti ulaganja u druge oblike imovine u hrvatskoj na zadovoljavajućem nivou i nivo ulaganja u hrvatske državne obveznice u relativnom omjeru ne u apsolutnom ali u relativnom omjeru u budućnosti će se definitivno
to je za vrijeme mandata sdpove vlade ali ja bi se htio vratiti na  10 alata koje mi kao vlada ćemo poduzeti da bi unaprijedili tržište plina i da bi on bil i sigurnija opskrba i što povoljnija cijena prvi krucijalnije porata kine,to je za vrijeme mandata sdpove vlade ali ja bih se htio vratiti na ovih 10 alata koje mi kao vlada ćemo poduzeti da bi unaprijedili tržište plina i da bi ono bilo i sigurnija opskrba i što povoljnija cijena prvi krucijalni je povratak inae
godine iznosila 556 danas je ona na razini oko 6 to je š uvijek okoj 1 ispod zasupljenosti muškaraca na tržištu rad dakle pomaka ima i vjerujemo daće i oim drugim izmjenama i značanjim ta razlika između zastupljenosti žene muškaracaa tršto rada biti još,godine iznosila 56 danas je ona na razini oko 61 to je još uvijek oko 1 ispod zastupljenosti muškaraca na tržištu rada dakle pomaka ima i vjerujemo da će i ovim drugim izmjenama i značajnim ta razlika između zastupljenosti žene i muškaraca na tržištu rada biti još
na način ne da posludavac da njegov suglasnost nego praktički podobivenoj obavijesti i ono što je također u savršnjim odredbama bitno napomenuti da se sva prava kojae su ukorištenju odredbe ovih izmjena zakona za zaposlenei zamo zaposlene roditelje će se primjenjivati od trenutka,na način ne da poslodavac da njegovu suglasnost nego praktički po dobivenoj obavijesti i ono što je također u završnim odredbama bitno napomenuti da se sva prava koja su u korištenju odredbe ovih izmjena zakona za zaposlene i samozaposlene roditelje će se primjenjivati od trenutka
gospodine bulj uvaženi zastupniče ne možemo pristupati projektima populistički znači ali želimo i detalna analizirati mi smo napravili detalnja analizu i p javna rasprava ima čitavniz problema s tim projektom mi više ne možemo su financirati i poticati to jed veloperski projekat koji se,gospodine bulju uvaženi zastupniče ne možemo pristupati projektima populistički ali želimo i detaljno analizirati mi smo napravili detaljnu analizu i postoji javna rasprava ima čitav niz problema s tim projektom mi više ne možemo sufinancirati i poticati to je diveloperski projekat koji se
rodinih i roditeljskih naknada bit će povećan sa 70 milijona kuna se milijardu 80 milijuna kuna dakle na 2 milijardi 7 i 30 t00 kuna i mislim da je to najbalji odgovor koliko smo usmireni da poboljšamo statu roditelja da pobolšamo statu ladih,rodiljnih i roditeljskih naknada bit će povećan za 750 milijuna kuna s milijardu 980 milijuna kuna dakle na 2 milijarde i 730 tisuća kuna i mislim da je to najbolji odgovor koliko smo usmjereni da poboljšamo status roditelja da poboljšamo status mladih
sudjelovanje u ekspertnoj grupi revizijskih tijela u javnoi nabavi na razini euu gdje e državna komisija zapravo bila jedan od naj istaknutih članova u djelu koj se odnosi na financijsko poslovanje državne komisije u 2018.j godini treba istaknuti da je sa osnove naknade za pokretanje žalbenog,sudjelovanje u ekspertnoj grupi revizijskih tijela u javnoj nabavi na razini eu gdje je državna komisija zapravo bila jedan od najistaknutijih članova u dijelu koji se odnosi na financijsko poslovanje državne komisije u 2018. godini treba istaknuti da je sa osnove naknade za pokretanje žalbenog
provedbenom savjetovanju sada zainteresiranom javnošću točno je objavljeno ssvi prijedlozi dakle sva mišljenja i sve primjedbe sa jasnim očitovanjem našeg ministarstva znači ministarstvo se očitovalo i to je nasta,provedbenom savjetovanju sa zainteresiranom javnošću točno je objavljeno svi prijedlozi dakle sva mišljenja i sve primjedbe sa jasnim očitovanje našeg ministarstva znači ministarstvo se očitovalo i to je na str
funkcioniranju drugostupanjske pravne zaštite obzirom da je visoki upravni sude zastao sa rješavanjem tužbe protiv odluka državne komisije tako da ćemo za pravo pravo sliku te drugostupanjske pravne zaštite imati teku izvješću za 200. godin u 20018. je pokrenu da su 7 2 upravna spora protiv odluka državne komisije što,funkcioniranju drugostupanjske pravne zaštite obzirom da je visoki upravni sud zastao sa rješavanjem tužbi protiv odluka državne komisije tako da ćemo zapravo pravu sliku te drugostupanjske pravne zaštite imati tek u izvješću za 2019g u 2017. pokrenuta su 72 upravna spora protiv odluka državne komisije što
sredstava financijska sredstva su već osigurana zbog toga što se ovim zakonom jasnije,sredstava financijska sredstava su već osigurana zbog toga što se ovim zakonom jasnije
provodimo a koje su usmjerene prema porpisiromaštva i socijalne isključenosti djece djece s invaliditetom i djce steškoćama u razvo,provodimo a koje su usmjerene prema borbi siromaštva i socijalne isključenosti djece djece sa invaliditetom i djece s teškoćama u razvoju
naknade u mirovinskim fondovima ispustiti ispod stope od jen znači mi smo značajno već,naknade u mirovinskim fondovima spustiti ispod stope od 1 a znači mi smo značajno već i
inspekcijski nadzor te prekršajne odredbe za provedbu su nadležna tijela ministarstvo zaštitu okoliše energetike carinska uprava ministarstva financija i hrvatse agencij za okoliš i prirodu s saki u okviru svoga djelokruga rada uredba sadrži mjere koje imaju za cilj smanjiti emisije flornih stakljaničkih plinova do 2003 za,inspekcijski nadzor te prekršajne odredbe za provedbu su nadležna tijela ministarstvo zaštite okoliša i energetike carinska uprava ministarstva financija i hrvatska agencija za okoliš i prirodu svaki u okviru svoga djelokruga rada uredba sadrži mjere koje imaju za cilj smanjiti emisije fluoriranih stakleničkih plinova do 2030. za
energetskih politika koja će energetika biti u službi gospodarstva i građana ne sama sebi svrha kao što je do sada bilo kad su se gradili razni,energetskih politika koja će energetika biti u službi gospodarstva i građana a ne sama sebi svrha kao što je do sada bilo kad su se gradili razni
kako bi se izjednačilo postupanje sa sredsvima s posebnog računa za financiranje izborne promižbe svih subjekata izuzeće od ovrhe sim ovrhe za naplatu troškova izborne promiđbe utvrđuje se i za sredsva posebnog računa za financiranje izborne promiđbe političke stranke,kako bi se izjednačilo postupanje sa sredstvima s posebnog računa za financiranje izborne promidžbe svih subjekata izuzeće od ovrhe osim ovrhe za naplatu troškova izborne promidžbe utvrđuje se i za sredstva posebnog računa za financiranje izborne promidžbe političke stranke
kontinuirano radi na pobeljšanju zaštite prava djece spremne na suradnju teži bolj budućnosti naše djece partneri smo i pravobraniteljici za djecu ali i svima koji rade na zaštiti i promicanju prava djece a sve u svrhu najboljeg interesa djece u rh,kontinuirano radi na poboljšanju zaštite prava djece spremna je na suradnju teži boljoj budućnosti naše djece partneri smo i pravobraniteljici za djecu ali i svima koji rade na zaštiti i promicanju prava djece a sve u svrhu najboljeg interesa djece u rh
on obuhvaća neke terene koje nisu u vlasništvu značih ima pravo korištenja priče i vode koja jden izvodno u hidroltrani taj projek se ne može realizirati bez hepa tak da javne rasprave koja će završit vidit ćemo i ostale argumente došli su primjedbe sa svih strana i na,on obuhvaća neke terene koji nisu u vlasništvu znači hep ima pravo korištenja peruče i vode koja ide nizvodno u hidroelektranu i taj projekt se ne može realizirati bez hepa tako da u javnoj raspravi koja će završiti vidjet ćemo i ostale argumente došle su primjedbe sa svih strana i na
danas suglasni da problema imamnogo ali da imamo i mnoštvo pozitivnih pomaka i to je onai cilj koji ostvarujemo zajedno u suradnji i sane vladilnim sektorom koji su naši partneri danas u ovdje u sabrnici istaknute dvijene vladine udruge udruga zamisli udruga,danas suglasni da problema ima mnogo ali da imamo i mnoštvo pozitivnih pomaka i to je onaj cilj koji ostvarujemo zajedno u suradnji i sa nevladinim sektorom koji su naši partneri danas su ovdje u sabornici istaknute dvije nevladine udruge udruga [unk]zamisli[unk] i udruga
uvaženi gospodine predsjedniče zastupnice i zastupnici uvažena gospođeo pravobraniteljice predstavnici udruga osoba s invaliditetom hrvatski sabor je uputio o vladi rh radi davanja mišljenja izvješće o pravu o radu pravobraniteljice za osobe s invaliditetom za 20116.u,uvaženi gospodine predsjedniče zastupnice i zastupnici uvažena gospođo pravobraniteljice predstavnici udruga osoba s invaliditetom hrvatski sabor je uputio vladi rh radi davanja mišljenja izvješće o radu pravobraniteljice za osobe s invaliditetom za 2016.
sve one procedure koje imamo nči nasvakim pojedinim izborima bilo da se radi o parlamentarnim europskim lokalnim ili predsjedničkim izborima također kao predlagatelje ovog zakona željeli smo jasno definirati poboljšati nači sve ne dostatke koji su bili u važećem zakonu,sve one procedure koje imamo na svakim pojedinim izborima bilo da se radi o parlamentarnim europskim lokalnim ili predsjedničkim izborima također kao predlagatelji ovog zakona željeli smo jasno definirati i poboljšati znači sve nedostatke koji su bili u važećem zakonu
određeni broj žalbi koji se izjavljuju be stvarne namjera da se ostvari određena pravna zaštita dakle u tom smislu definitivno održovna komisija daje određene potice za eventualno određene izmjene zakona i slično,određeni broj žalbi koje se iz izjavljuju bez stvarne namjere da se ostvari određena pravna zaštita dakle u tom smislu državna komisija daje određene poticaje za eventualno određene izmjene zakona i
načela mogućnosti jednakog postupanja prema muškarcima i ženama u pitanjima zapošljavanja i rada krajem 203. godine pokrenut je eupilo u vezi s predmetnom direktivom te je europska komisija utvrdila kako u pogledu zaštitu od biktimizacije postoje,načela mogućnosti i jednakog postupanja prema muškarcima i ženama u pitanjima zapošljavanja i rada krajem 2013. godine pokrenut je eu pilot u vezi sa predmetnom direktivom te je europska komisija utvrdila kako u pogledu zaštite od viktimizacije postoje
roitra svima poštovani predsjedniče poštovani zastupnici,svima poštovani predsjedniče poštovani zastupnici
zaredovito godišnje financiranje političkih stranaka nezavisnih zastupnika odnosno nezavisnih viješnika predlviđena je mogućnost da se nezavisni zastupnici nezavisnim vijesici mogu odreći prava na financiranj i proračuna te se uređuje postupanje o slučaju odrcanja odnavedenog prava,za redovito godišnje financiranje političkih stranaka nezavisnih zastupnika odnosno nezavisnih vijećnika predviđena je mogućnost da se nezavisni zastupnici i nezavisni vijećnici mogu odreći prava na financiranje iz proračuna da se uređuje i postupanje u slučaju odricanja od navedenog prava
čuli većara su raspravija s čim se manje više neslažem tako da to baš nije strukturirano i složen po redosljedu važnosti jel ima jedna stvar koja baš jako dbro dobro dolazi dolazi ovako a to je činjenica šta je,čuli večeras u raspravi a s čime se manjeviše ne slažem tako da to baš nije strukturirano i složeno po redoslijedu važnosti ali ima jedna stvar koja baš jako dobro dolazi ovako a to je činjenica šta je
pitanje a možda radi malo boljeg podsjetnika njemačka 50 gdn od 7 druge godine kontinuirano ima prirodni pad  stano niša dakle to se jednim dijelom kompezira na bazi migracija međutim staranje stalon ištva je vrlo intenzivno kao je većini državar članica tako da evo čisto radi jedne potpun putpunije,pitanje a možda radi malo boljeg podsjetnika njemačka od prije 50g od 72g kontinuirano ima prirodni pad stanovništva dakle to se jednim dijelom kompenzira na bazi migracija međutim starenje stanovništva je vrlo intenzivno kao i u većini država članica tako da evo čisto radi jedne potpunije
tako da će se ondobivati za trćtvrte djete ujedno predloženim nacrtom prijedloga zakona mijenja se odredba odobne granici za ostvarivanje prava na doplatak za djete koje pohađa srednju školnu na način da se omogućuje korištenje doplatka za onu djesu učenike srednje škole ći i programi srednjuškolskog obrazovanja,tako da će se on dobivati za treće i četvrto dijete ujedno predloženim nacrtom prijedloga zakona mijenja se odredba od dobnoj granici za ostvarivanje prava na doplatak za dijete koje pohađa srednju školu na način da se omogućuje korištenje doplatka za onu djecu učenike srednje škole čiji programi srednjoškolskog obrazovanja
ukupnom području rhvs,ukupnom području republike hrvatske
znači ukoliko su fiskalni kapaciteti jedinica lokalne i regionalne samouprave nešto veći da mogu znaći dodijeliti i više sredstava što se tiče samo referenduma i vašog stavareferendumu,znači ukoliko su fiskalni kapaciteti lokalne i regionalne samouprave nešto veći da mogu dodijeliti i više sredstava što se tiče samog referenduma i vašeg stava o referendumu
nastojanju da uvijek bude usmjirena ka 3 osnovna cilja transparentnosti učinkovitosti i neovisnosti državna komisija uživa visoki ugledu hrvatskoj općoj i stručnoj javnosti kao i o institucijama eo kmisije i to prij svega popitajuju učinkovitosti i pravne dosljednosti usporednim pokazateljima pravnoj zaštiti u,nastojanju da uvijek bude usmjerena ka 3 osnovna cilja transparentnosti učinkovitosti i neovisnosti državna komisija uživa visoki ugled u hrvatskoj općoj i stručnoj javnosti kao i u institucijama europske komisije i to prije svega po pitanju učinkovitosti i pravne dosljednosti usporednim pokazateljima u pravnoj zaštiti u
roditelja i za planiranje obitelji a osobito za uskluđivanje o piteljskog i poslovnog  života čime kažem evo drugih puta smo u mandatu vlade intervenirali značajno povećali iznose ove naknade stoga molim da se prihvate prijedloziev ovih izmjena zakona hvala,roditelja i za planiranje obitelji a osobito sa usklađivanje obiteljskog i poslovnog života čime kažem evo drugi puta smo u mandatu vlade intervenirali značajno povećali iznose ove naknade stoga molim da se prihvate prijedlozi evo ovih izmjena zakona hvala
86 sluča,86 slučajeva
najvišem domu u hrvatskom saboru stoga se nadam da će i ovi propisi koje imamo iako su u određenim djelovima jasno istaknuti ali tu je naravno i tekako važna politička volja posebice politička volja dvije najveće političke stranke,najvišem domu u hrvatskom saboru stoga se nadam da će i ovi propisi koje imamo iako su u određenim dijelovima i jasno istaknuti ali tu je naravno itekako važna politička volja posebice politička volja dvije najveće političke stranke
znači razvoj snažni razvoj togg projekta ali kasnije će se osvrnit na njega još četvrta miraje ia novi diversifikacijski dobavni pravac minista ide sljedeći i tijedazerbeđan kako bi ubrzao taje projekti na najvišem nivo lobirao da eon što prije desi,znači razvoj snažni razvoj tog projekta ali kasnije ću se osvrnuti na njega još četvrta mjera je iap tap novi diversifikacijski dobavni pravac ministar ide sljedeći tjedan u azerbajdžan kako bi ubrzao taj projekt i na najvišem nivou lobirao da se on što prije desi i
mandat preuzima slijedeći saliste koji je bio i nije nužno da treba biti u političkoj stranciju koje bio njegov kolega saliste što znači da tada predstaju prava prema,mandat preuzima slijedeći sa liste koji je bio i nije nužno da treba biti u političkoj stranci u kojoj je bio njegov kolega sa liste što znači da tada prestaju prava prema
određene zabrinutosti kojeje potrebno riješiti slijedom navedenog konačnim prijedlogom zakona članag 2 zakona o ravnopravnosti spolova usklađuje se sa člnkom 7. zakona o suzbijanju diskriminacije kako bi se osigurala sve obuhvatna zaštita odviktimizacije,određene zabrinutosti koje je potrebno riješiti slijedom navedenog konačnim prijedlogom zakona članak 2. zakona o ravnopravnosti spolova usklađuje se sa člankom 7. zakona o suzbijanju diskriminacije kako bi se osigurala sveobuhvatna zaštita od viktimizacije
sustava a pogotovo javnih naručitelja prema ocjeni državna komisije a sukladno preporukama europske komisije o nužnosti profesionalizacije javnih naručitelja predstavljaju najznačajniji orak u daljnjem razvoju sustava nabave u rh,sustava a pogotovo javnih naručitelja prema ocjeni državne komisije a sukladno preporukama europske komisije o nužnosti i profesionalizaciji javnih naručitelja predstavljaju najznačajniji korak u daljnjem razvoju sustava nabave u rh
projektna dokumentacija dokumentacija u tim postupcima je kompleksna i odgovornost državne komisije u takvim postupcima je još većea zbog toga što znači nekakve nepravilnosti koje se događaju u postupcima nabave u pripremi provedbi mogu rezultirati ogromnim financijskim korekcijama za za državni,projektna dokumentacija dokumentacija u tim postupcima je kompleksna i odgovornost državne komisije u takvim postupcima je još veća zbog toga što znači nekakve nepravilnosti koje se događaju u postupcima nabave u pripremi i provedbi mogu rezultirati ogromnim financijskim korekcijama za državni
mi danas imamo akcijski plan koji je donešen za razvoj javne uprave od20017. do 20020 tamo je predviđeno 20 projekata 880 milijunak aimate da se oni provedu ali vi ste otok svega odabrali ništa kad ovoj vladi,mi danas imamo akcijski plan koji je donesen za razvoj javne uprave od 2017. do 2020. tamo je predviđeno 20 projekata 80 milijuna kuna imate da se oni provedu ali vi ste od toga svega odabrali ništa kada ovoj vladi
vvla lijepa poštovani gospodine predsjedniče cinjene zastupnice i zastupnici pred vama se nalazi prijedlog zakona o izmjenama i dopunama zakona o tržištu plina koji ge rh dodatno usklađuje sa zakonodavstom u eu,hvala lijepa poštovani gospodine predsjedniče cijenjene zastupnice i zastupnici pred vama se nalazi prijedlog zakona o izmjenama i dopunama zakona o tržištu plina kojeg rh dodatno usklađuje sa zakonodavstvom eu
onoga koji smo poicirali razlogi što je potpuno držim prihvatlivo svima povećanja osobnih dohodaka povećanja dakle svig drugih primitaka koji su ušli u kategoriju prihoda po članu kućanstva,onoga kojeg smo projicirali je razlog i što potpuno držim prihvatljivo svima povećanje osobnih dohodaka povećanje dakle svih drugih primitaka koji su ušli u kategoriju prihoda po članu kućanstva
milijuna kuna dio koji se odnosi na obvezne mirovinske fondove znači taj dio naknada  ili nešto nešto više kažem molim,milijuna kuna dio koji se odnosi na obvezne mirovinske fondove znači i taj dio naknada ili nešto više kažem molim
ključeno jest obrazovanje i mislim da je važno iovdje istaknuti da je ministarstvo obrazovanje za školsku godinu 2s i177. 218. osiguralo 200 pomoćnika u nastavi koji pružaju uslugu za 2067 učenika s teškoćama u,ključno jest obrazovanje i mislim da je važno i ovdje istaknuti da je ministarstvo obrazovanja za školsku godinu 2017 2018. osiguralo 2317 pomoćnika u nastavi koji pružaju uslugu za 2670 učenika s teškoćama u
nova istraživanja mi ćemo realizirati ugovore o istraživanju u glikodika koji prethodna vlada nije uspjela 2  blokua nula ugovora nači 20 blokoa nugo ogora a mi smo ih potpisali već 5 5tugovora za istraživanje,nova istraživanja mi ćemo realizirati ugovore o istraživanju ugljikovodika koji prethodna vlada nije uspjela 29 blokova nula ugovora znači 29 blokova novoga ugovora a mi smo ih potpisali već 5 ugovora za istraživanje i
posloženo sve usvem ja osobno mogu reći od samo početka sam u ovom sustavu prije nego što se u opće osnivala mirovinska društva bavio s se tim temama profesionalno isključivo o 2004vt i mogu reći da se radio jednom sustavu,posloženo sve u svemu ja osobno mogu reći od samog početka sam u ovom sustavu prije nego što su se uopće osnivala mirovinska društva bavio sam se tim temama profesionalno i isključivo od 204. i mogu reći da se radi o jednom sustavu
razvoju dakle povećava se iz godine u godinu taj broj korisnika potpora oni sredstva su osigurana i sredstava europskog socijalnog fonda putemmatijčaja sredcvima na igr za igrena sreću koji hosigaravu se preko udruga i sredstvima i proračune jedinice lokalne i područnje,razvoju dakle povećava se iz godine u godinu taj broj korisnika potpora oni sredstva su osigurana iz sredstava iz europskog socijalnog fonda putem natječaja sredstvima za igre na sreću kojih osiguravaju se preko udruga i sredstvima iz proračuna jedinice lokalne i područne
